Job Title,Role,Level,Years of Experience,Company,Location,Salary Range,Required Skills,Source Platform
Senior Executive Product Management,data scientist,Junior,2,Hong Leong BANK Vietnam Limited,Hồ Chí Minh,Thương lượng,"Product Management, UAT testing, Stakeholder Management, Project Management, Communication Skills",Vietnamworks
Requirement Engineer Technical Business Analyst (Quantity: 02),business analyst,Any Level,N/A,LG Electronics R&D Vietnam,Hà Nội,Thương lượng,"English, Business analysis, System Analysis, ALM, Process Quality Improvement",Vietnamworks
Technical/ Solution Architect,solutions architect,Senior,6,Hitachi Digital Services,Hồ Chí Minh,Thương lượng,"Object Oriented Design, Project Management, Relational Database Design, Software Development, Fluent In English",Vietnamworks
Trưởng Phòng Sản Phẩm Và Giải Pháp (Mức Lương Từ 30.000 Usd/năm) - Làm Việc Tại Mozambique,data scientist,Any Level,N/A,Movitel S.A,Mozambique,Thương lượng,"Tài Chính Ngân Hàng, Kinh Doanh Ví Điện Tử, Phát Triển Sản Phẩm",Vietnamworks
Quality Engineer (Thành thạo Tiếng Trung),software engineer,Any Level,N/A,Navigos Search's Client,Hưng yên,$1500.00-1600.00,"Tiếng Trung, Chinese, Quản lý chất lượng, QC, RBA",Vietnamworks
System Engineer (Dyehouse),systems engineer,Junior,1,Coats Phong Phu,"Hà nội, Hồ Chí Minh",Thương lượng,"Chemical Management Systems, Electrical System Engineering, Information Technology, System Control",Vietnamworks
Senior Telematic Developers (Joining Bonus),software developer,Senior,5,Bosch Global Software Technologies Company Limited,Hồ Chí Minh,Thương lượng,"C/C++, Teamwork, Telematics, Linux Programming, Automotive Sdlc",Vietnamworks
Senior Front End Developer (React),frontend developer,Senior,7,Arctx Solution LLC,Hồ Chí Minh,Thương lượng,"ReactJS, JavaScript, Front End, AngularJS",Vietnamworks
Senior Business Project Management Officer,data scientist,Senior,6,Trusting Social,Hồ Chí Minh,Thương lượng,"Project Management, Business Strategy",Vietnamworks
Microsoft Dynamics 365 F&O Analyst (Focus Production),SAP consultant,Intermediate,3,Công Ty TNHH Omnicomm Việt Nam,Hồ Chí Minh,$2200.00-2500.00,"English, Manage ERP Software, Microsoft Dynamics 365, Production Module Expertise, Bpmn 2.0",Vietnamworks
IT Engineer (Thành thạo Tiếng Trung),software engineer,Any Level,N/A,Navigos Search's Client,Hưng yên,$1500.00-1600.00,"IT System Administration, IT Hardware, IT Administration, Tiếng Trung, Chinese",Vietnamworks
DevOps Engineer (Atlassian Tools),DevOps engineer,Any Level,N/A,"Renesas Design Vietnam Co., Ltd.",Hồ Chí Minh,Thương lượng,"Git, SVN, Linux, DevOps",Vietnamworks
Front-End & Mobile Developer/software Engineer,frontend developer,Any Level,N/A,Manulife (Việt Nam),Hồ Chí Minh,Thương lượng,"AngularJS, React Native",Vietnamworks
Java Android Software Engineer (Relocation Bonus - Hybrid Working - Salary Up to 2500$),mobile developer,Any Level,N/A,LG Electronics Development Vietnam Company Limited,Hà nội,$800.00-2500.00,"Java, Java Spring Framework, Software Engineering, Automotive",Vietnamworks
Full Stack Software Engineer,full stack developer,Intermediate,3,Công Ty TNHH HaskoningDHV Việt Nam,"Hà nội, Hồ Chí Minh",Thương lượng,"Java, Typescript, Azure, VueJS, Full Stack Development",Vietnamworks
Process Quality Assurance - Lương Thưởng Hấp Dẫn,QA engineer,Intermediate,3,Công Ty Cổ Phần Tư Vấn Công Nghệ Ngs (Ngsc),Hà Nội,$1500.00,"Công Nghệ Thông Tin, Đánh Giá Chất Lượng, QA, Agile Scrum, Tiếng Anh",Vietnamworks
Quality Inspector/ Senior Quality Inspector,IT professional,Junior,2,Sharkninja Vietnam,Hồ Chí Minh,Thương lượng,"Data Analysis, English, independent work, MS Office, Quality Inspection",Vietnamworks
MIS Data Analyst,data analyst,Intermediate,3,"Vietnam Intersnack Cashew Co., Ltd",Hồ Chí Minh,Thương lượng,"Analytical Skills, Data Modeling, MS Office, Power BI, Sales Reporting",Vietnamworks
"Senior Full Stack Developer (NodeJS, SQL, JavaScript)",full stack developer,Intermediate,4,Công Ty TNHH HDS Dịch Vụ Việt Nam,Hồ Chí Minh,Thương lượng,"Full Stack Development, NodeJS, RESTful API, SQL, JavaScript",Vietnamworks
React Native Developer,software developer,Senior,5,Pronto Pilates Pty Ltd,Australia,Thương lượng,"CSS, HTML, JavaScript, React Native, Team Work",Vietnamworks
Vehicle Tester_Automotive Domain (Tester),QA engineer,Junior,2,Luxoft Vietnam,Hồ Chí Minh,Thương lượng,"Vehicle Testing, Automotive, CANoe, CANoe, CANoe, Debug, Test Cases",Vietnamworks
STA Engineer,software engineer,Junior,2,FPT IS,Hà Nội,$2500.00,"Điện Tử, Verilog, Thiết Kế Vi Mạch Điện Tử, Physical Design, Semiconductor",Vietnamworks
Physical Design Engineer (Hybrid Working),software engineer,Intermediate,3,Navigos Search,"Hà nội, Hồ Chí Minh",$2040.82-2857.14,"Physical Design, RTL Development, Floorplan, English: Intermediate Level, Semiconductor Process",Vietnamworks
Head of IT Department,IT professional,Senior,5,Public Bank Securities Vietnam Company Limited (PBSV),N/A,Thương lượng,"Information Security, Trading Platforms, Computer Science, Fintech, Leadership",Vietnamworks
Mobile Developer (Tiếng Nhật N1~N4),mobile developer,Any Level,N/A,Công Ty TNHH GMO-Z.com Financial System VN,Hà Nội,$1000.00-3000.00,"Tiếng Nhật N4, Unit Testing, Android, Mobile App Development, Kotlin",Vietnamworks
Senior Solution Architect (.NET Core; React; Node.js),solutions architect,Senior,5,Công Ty TNHH Công Nghệ Và Giải Pháp Phần Mềm Crossian,Hà Nội,Thương lượng,"AWS Cloud services, .NET Core, HTML5, DevOps, Leadership",Vietnamworks
IT Software Engineer,software engineer,Any Level,N/A,Công Ty TNHH Framas Korea Vina,Đồng Nai,Thương lượng,"Software Engineering, .Net, SQL, Oracle, Software Development",Vietnamworks
4G/5G RAN Engineer,software engineer,Any Level,N/A,Công Ty TNHH Công Nghệ Huawei Việt Nam,Hà nội,Thương lượng,"Wireless Network, Telecommunications, Computer Science, RAN System, OS System",Vietnamworks
Product Operations Specialist - Agi,data scientist,Junior,2,Trusting Social,Hồ Chí Minh,Thương lượng,"Product Operation, Product Development, Project management skills, Quality Process Improvement",Vietnamworks
Senior Business Intelligence,data analyst,Intermediate,4,Navigos Search's Client,Hà nội,$2000.00-2500.00,"Business Intelligence, Data Analysis, Machine Learning, Team Management",Vietnamworks
Chuyên Viên Chính Phân Tích và Chiến Lược Thu Hồi Nợ - Trung Tâm Fico,data engineer,Junior,2,Ngân Hàng TMCP Tiên Phong (Tpbank),Hồ Chí Minh,$900.00,"Phân Tích Dữ Liệu, Quản Lý Dữ Liệu, Big Data, Data Warehouse Systems, Data Lake",Vietnamworks
Giám Đốc Công Nghệ Thông Tin Tập Đoàn Thành Viên,data scientist,Intermediate,4,Công Ty Cổ Phần Tập Đoàn Trường Hải (Thaco),Hồ Chí Minh,Thương lượng,"AI/ML, CIO, CTO, ERP Implementation, Leadership",Vietnamworks
Chuyên Viên Lập Trình & Phát Triển Bitrix24 CRM (Bitrix24 Specialist),IT professional,Intermediate,3,Công Ty TNHH MTV Cho Thuê Tài Chính Ngân Hàng Sài Gòn Thương Tín,Hồ Chí Minh,Thương lượng,"Bitrix24, Apache Webserver, Nginx, PHP, Kỹ Thuật",Vietnamworks
Cybersecurity Audit Manager,IT professional,Senior,5,Navigos Search,"Hà nội, Hồ Chí Minh",$2500.00-3000.00,"Vulnerability Scanning, Penetration Testing, Network Security, IT Auditing, Communication Skills",Vietnamworks
Automotive Test Engineer (Manual),software engineer,Junior,1,LG Electronics Development Vietnam Company Limited,Hà Nội,$600.00-1500.00,"Software Programming, Software Testing, Test Cases, Automation Test Script, Automotive Engineering",Vietnamworks
Devops Engineer,DevOps engineer,Any Level,N/A,GSM,Hà Nội,$1000.00-3000.00,"Software Development, Software Architecture Design, DevOps, Cloud AWS, Cloud",Vietnamworks
Senior Data Governance - Hà Nội - Ta139,data engineer,Intermediate,3,VPBank - Https://tuyendung.vpbank.com.vn/,Hà Nội,Thương lượng,"Databases, ngân hàng, Quản Trị Dữ Liệu, SQL, Tài Chính",Vietnamworks
SAP MM Specialist,SAP consultant,Any Level,N/A,Vinfast Trading And Production JSC,Hà nội,Thương lượng,"SAP S/4HANA, SAP PP, SAP Material Management, SAP Master Data, SAP ECC 6.0",Vietnamworks
Pre-sale Engineer,software engineer,Junior,1,CÔNG TY CP ĐẦU TƯ CÔNG CÔNG NGHỆ VÀ GIẢI PHÁP TMC VIỆT NAM,N/A,$612.24-1020.41,"Giải Pháp Bảo Mật, Bán Hàng Kỹ Thuật, Kinh Doanh, Physical Security, Tư Vấn",Vietnamworks
IT Engineer,software engineer,Intermediate,3,Công ty TNHH BIGL Việt Nam,Thái Nguyên,$800.00-1500.00,"Technical Support, Systems Engineering, Database Administration, Software Development, Problem-solving",Vietnamworks
Web Developer,software developer,Any Level,N/A,Công Ty Cổ Phần Thế Giới Công Nghệ Phần Mềm,Hồ Chí Minh,$500.00-1000.00,"MySQL, JavaScript, C#, ASP.NET, .NET",Vietnamworks
Senior Automation Tester,QA engineer,Intermediate,3,FPT Software,"Hồ Chí Minh, Hà Nội, Đà Nẵng",Thương lượng,"Agile, Automation Testing, SQL, Unit Testing, API Testing",Vietnamworks
.NET Developer Fulltime Remote,software developer,Junior,2,Soda Digital,Australia,$1000.00-2000.00,".Net Core, MS SQL, Entity Framework, Umbraco, JavaScript",Vietnamworks
[HCM] Business Analyst - Delivery,business analyst,Intermediate,3,Pizza 4P's,Hồ Chí Minh,Thương lượng,"English fluency, Analytical Skills, F&B Business, Communication English",Vietnamworks
CVCC Kiểm Định Mô Hình - Model Validation Senior Specialist - Khối Dữ Liệu (Ho24.302),business intelligence analyst,Junior,1,Ngân Hàng Thương Mại Cổ Phần Quân Đội - MB,Hà nội,Thương lượng,"SQL, Data Visualization, Khoa Học Dữ Liệu, Power BI, Thu Thập Dữ Liệu",Vietnamworks
IT Service Desk,IT professional,Junior,1,Shinhan Vietnam Finance Company Limited,Hồ Chí Minh,Thương lượng,"IT Helpdesk, IT Support, File Server, LAN",Vietnamworks
System Engineer,systems engineer,Intermediate,3,"Wide Viet Nam CO., LTD.",Hồ Chí Minh,Thương lượng,"Azure, Fortigate Firewall, Microsoft Office 365, Quản Trị Hạ Tầng Cisco, Veeam Backup",Vietnamworks
Senior Project Manager (Tech & Non Tech),project manager,Intermediate,4,"Neyu Ltd.,",Hồ Chí Minh,Thương lượng,"Project Management, Business Development, Call Center Management, Pmp Certification, Call Center System",Vietnamworks
UI/UX Designer,UX/UI designer,Intermediate,3,Công Ty Cổ Phần Chứng Khoán SSI,Hà Nội,Thương lượng,"UI/UX, Figma, UX Research, Mobile App, Thiết Kế Website",Vietnamworks
IC TEST Development Engineer,software engineer,Senior,5,Công Ty TNHH Qorvo Việt Nam,Hà nội,Thương lượng,"PCB Layout Design, I2C, C/C++ Programming, Hardware Testing, Debug",Vietnamworks
SAP FICO Specialist,SAP consultant,Any Level,N/A,Công Ty Trách Nhiệm Hữu Hạn Sản Xuất Và Kinh Doanh Vinfast - Thành Viên Của Vingroup,Hà Nội,Thương lượng,SAP,Vietnamworks
Chuyên Viên Kiểm Soát Số Liệu Tài Chính - Financial Data Controller - Khối Tài Chính Kế Toán (Ho24.321),data engineer,Junior,2,Ngân Hàng Thương Mại Cổ Phần Quân Đội - MB,Hà nội,Thương lượng,"Big Data, Data Engineer, Data Lake, Open Source Framework, Spark",Vietnamworks
Chuyên Viên Phân Tích Nghiệp Vụ,data scientist,Senior,5,"Công Ty Cổ Phần Công Nghệ Thông Tin, Viễn Thông Và Tự Động Hoá Dầu Khí",Hà Nội,$850.34-1700.68,"ERP, Business Analysis, Công Nghệ Thông Tin, Triển Khai Hệ Thống, Phân Tích Nghiệp Vụ",Vietnamworks
[Hải Phòng] Chuyên viên hạ tầng CNTT,embedded systems engineer,Junior,1,VINFAST TRADING AND PRODUCTION JSC,Hà nội,Thương lượng,"An Ninh Mạng, Công Nghệ Thông Tin, Dịch Vụ Viễn Thông, Giao Tiếp, Điện Tử Viễn Thông",Vietnamworks
Chuyên Viên IT,IT professional,Senior,5,Công Ty Cổ Phần Quản Lý Đầu Tư ACD,Hà Nội,Thương lượng,"Hardware Support, Hardware Maintenance, Kiểm Tra Phần Cứng, Cài Đặt Phần Mềm, Công Nghệ Thông Tin",Vietnamworks
Embedded Software Engineer (Automotive),software engineer,Any Level,N/A,Hitachi Digital Services,Hồ Chí Minh,Thương lượng,"Embedded Software, Automotive, AUTOSAR, C/C++, MCU Programming",Vietnamworks
Project Management Office (PMO) Assistant,data scientist,Any Level,N/A,Chi Nhánh Công Ty TNHH KPMG,Hồ Chí Minh,Thương lượng,"Problem Solving, Project Management, Oracle, Scrum",Vietnamworks
Automation Test Engineer,software engineer,Junior,2,Navigos Search,"Hà nội, Hồ Chí Minh",$1000.00-2000.00,"Automated Software Testing, Evaluation Method, Test Design, Python Programming, Troubleshooting",Vietnamworks
Project Coordinator ITS,IT professional,Intermediate,3,RMIT University Vietnam,Hồ Chí Minh,Thương lượng,"Communication, Customer Service, Microsoft Office, Project Coordination, Time Management",Vietnamworks
IT Japanese Communicator,IT professional,Junior,2,LG Electronics Development Vietnam Company Limited,Hà Nội,$800.00-1200.00,"Japanese N2, Problem Management, Teamwork, TOEIC 700, It Background",Vietnamworks
"Back-end Developer (Java, SQL, Spring, English,chinese)",backend developer,Junior,1,Công Ty TNHH Clever Creations Tech,Hồ Chí Minh,$500.00-1500.00,"Java, SQL, Java Spring Framework, Chinese Madarin, B2 English",Vietnamworks
Chuyên Viên Sản Phẩm/ Product Specialist,data scientist,Junior,2,"Transmedic Healthcare Co., LTD",Hồ Chí Minh,Thương lượng,"Biomedical Engineering, Electrical Engineering, English, Technical Support, Preventive Maintenance",Vietnamworks
Web Developer (Tiếng Nhật N1~N4),software developer,Any Level,N/A,Công Ty TNHH Gmo-Z.com Financial System VN,Hà Nội,$1000.00-3000.00,"React, Website Development, Node.js, Tiếng Nhật N4, Unit Testing",Vietnamworks
Nhân Viên Triển Khai Phần Mềm POS,data scientist,Junior,1,Công Ty Cổ Phần Công Nghệ KAS,Hồ Chí Minh,Thương lượng,"POS System, POS Software Testing, Triển Khai Phần Mềm, Đào Tạo Khách Hàng, Hỗ Trợ Kỹ Thuật",Vietnamworks
Linux System Engineer,systems engineer,Junior,1,Công Ty TNHH Thankslab Việt Nam,Hồ Chí Minh,Thương lượng,"Aws, Docker, Docker, Docker, Linux, NodeJS, PHP",Vietnamworks
[$4000 - $5000] Software Engineering Manager (Front-End),frontend developer,Senior,5,Navigos Search's Client,Hà nội,$4000.00-5000.00,"Angular, Angular, Angular, Front-End, Kotlin, Swift, Swift, Typescript",Vietnamworks
Chuyên Viên Hỗ Trợ Người Dùng (IT Helpdesk),IT support,Any Level,N/A,Tập Đoàn BRG (BRG Group),Hà Nội,Thương lượng,"IT Helpdesk, Công Nghệ Thông Tin, IT Phần Cứng, IT System Administration",Vietnamworks
Vận Hành Games (Ưu Tiên Tiếng Trung ),game developer,Junior,2,Công Ty TNHH Dịch Vụ Tư Vấn Bát Giới,Hồ Chí Minh,$780.00-1100.00,"Game Research, Game Operation, Vận Hành Game, Mobile Game Development, Technology Development",Vietnamworks
Release Train Engineer,software engineer,Senior,8,Capgemini Vietnam,Hồ Chí Minh,Thương lượng,"Agile Project Management, Scrum Master, Stakeholder Management, Project Management, Lifecycle Management",Vietnamworks
C/C++ Linux Software Engineer,software engineer,Any Level,N/A,LG Electronics Development Viet Nam Company Limited,"Hà nội, Hà Nội",$1000.00-2500.00,"C/C++, Linux Embedded, Linux, Software Development, Software Engineering",Vietnamworks
Software Developer,software developer,Intermediate,3,"WANEK FURNITURE CO., LTD.",Hồ Chí Minh,Thương lượng,"AS400, English Language Proficiency, ERP System, ERP System, Software Development Lifecycle, Software Development Lifecycle, Software Development Lifecycle, Software Management",Vietnamworks
IT Support Specialist,IT support,Any Level,N/A,Công Ty TNHH Công Nghệ Và Giải Pháp Phần Mềm Crossian,Hà Nội,Thương lượng,"IT System Administration, IT Helpdesk, IT Support, Infrastructure Supervision, Application Support",Vietnamworks
"Data Analyst (SQL, Power Bi, Database)",data analyst,Junior,2,Ngân Hàng TMCP Quốc Tế Việt Nam (VIB),Hồ Chí Minh,Thương lượng,"Data analysis, SQL, Power BI, Python",Vietnamworks
Kỹ Sư Công Nghệ Thông Tin (IT),IT professional,Junior,2,Công Ty TNHH CTCI Việt Nam,Hà Nội,Thương lượng,"Quản Trị Mạng Công Ty, Quản Trị Dữ Liệu, Hệ Thống Điện Thoại, Công Nghệ Thông Tin, Quản Trị Hệ Thống",Vietnamworks
Kỹ Sư Kiểm Thử Sản Xuất,embedded systems engineer,Any Level,N/A,Navigos Search's Client,Hà nội,$800.00-1200.00,"Testing, Electronic Troubleshooting, English, Wireshark, PLC",Vietnamworks
Business Analyst,business analyst,Intermediate,3,Công Ty Cổ Phần Tập Đoàn Golden Gate,Hà Nội,Thương lượng,"Product Development, Business Analysis, Information System, Agile, F&B Business",Vietnamworks
Senior Business Analyst (Analytics Consultant),business analyst,Junior,2,MiTek Việt Nam,Hồ Chí Minh,Thương lượng,"Business Analysis, Data Analytics, Business Analyst, English B2, Consultant",Vietnamworks
Senior .NET Developer,software developer,Senior,5,Capgemini Vietnam,Hồ Chí Minh,Thương lượng,"Web API, Azure, .Net, C#, OOP",Vietnamworks
QC Tester Automation,QA engineer,Any Level,N/A,MCGAAW,Hồ Chí Minh,Thương lượng,"Test Automation Tools, Programning Languages, API Testing, Automation Testing, Software Testing",Vietnamworks
"IOS Developer (Junior, HCM)",mobile developer,Junior,1,FPT Telecom,Hà Nội,Thương lượng,"iOS Development, Material Design, Objective C, Swift, Swift, Web Service",Vietnamworks
SAP ABAP Performance Architect (Joining Bonus),IT professional,Senior,7,Bosch Global Software Technologies Company Limited,Hồ Chí Minh,Thương lượng,Computer Science,Vietnamworks
"Phân Tích Cường Độ Của Máy Xúc Xây Dựng (Bộ Phận Cabin)(pm: HyperMesh, Radioss)",mobile developer,Junior,1,Công Ty TNHH R Techno Việt Nam,Hồ Chí Minh,Thương lượng,"Hypermesh, Radioss, Thiết Kế Máy Xây Dựng, Tiếng Nhật N3, Phân Tích Cường Độ",Vietnamworks
"Chuyên Viên Chính/chuyên Viên Cao Cấp Phân Tích Dữ Liệu và Quản Trị Hệ Thống (Thành thạo Excel, Sql,powerbi)",data analyst,Intermediate,3,Ngân Hàng TMCP Quốc Tế Việt Nam (VIB),Hồ Chí Minh,Thương lượng,"SQL, Power BI, Data reporting, Excel",Vietnamworks
Experienced Automation Tester _ Freelancer (Location: Hà Nội),QA engineer,Intermediate,3,Capgemini Vietnam,Hồ Chí Minh,Thương lượng,"Automation Testing, QA, QC, Software Testing, API Testing",Vietnamworks
Android App Developer,mobile developer,Senior,5,Cathay United Bank,Taiwan,Thương lượng,"Agile Development, CI/CD, Clean Architecture, MVVM Architecture, RESTful API",Vietnamworks
Data Analyst,data analyst,Any Level,N/A,Edge Consulting Engineers,Hồ Chí Minh,Thương lượng,Data Analysis,Vietnamworks
Technical Support Specialist,IT support,Junior,1,CÔNG TY TNHH GETCOURSE VIỆT NAM,N/A,Thương lượng,"Technical Support, Troubleshooting, Customer Support, CSS, SaaS",Vietnamworks
Chuyên Viên Chính Sách Quản Lý Rủi Ro - Công Nghệ Thông Tin,security engineer,Junior,1,Ngân Hàng TNHH Indovina – Hội Sở,Hồ Chí Minh,Thương lượng,"IT Security GRC, Risk Compliance, IT Risk Management, IT Governance, IT Operations",Vietnamworks
Senior Full Stack Engineer Cloud Marketplace,full stack developer,Senior,5,Bosch Global Software Technologies Company Limited,Hồ Chí Minh,Thương lượng,"Java Spring Boot, Restful Apis, Cloud Native Applications, Frontend Frameworks, Sql And No-Sql Databases",Vietnamworks
Supply Chain Digital BA (Management Level),business analyst,Senior,8,HEINEKEN Vietnam,Hồ Chí Minh,Thương lượng,English,Vietnamworks
Foxconn Tuyển Gấp Kỹ Sư Phát Triển Phần Mềm Hệ Thống,backend developer,Any Level,N/A,Công Ty TNHH Công Nghệ Chính Xác Fuyu,Hồ Chí Minh,$500.00-1000.00,"Lập Trình Backend, API, Systems Development, Database Development, English",Vietnamworks
Chuyên Viên An Ninh Bảo Mật,data scientist,Junior,1,Công ty Cổ phần Chứng khoán Bảo Việt,Hà Nội,$700.00-1200.00,"An Toàn Thông Tin, Quản Lý Rủi Ro, An Ninh Mạng, CEH, IDS/IPS",Vietnamworks
Oracle Functional Consultant,database administrator,Intermediate,3,Chi Nhánh Công Ty TNHH KPMG,Hồ Chí Minh,Thương lượng,"Analytical Thinking, Financial performance, Oracle Cloud, Order Management, Procurement",Vietnamworks
Infrastructure Architect/ IT System (Manufacturing) - Open for Junior Level/freshers,IT professional,Junior,1,Unilever Vietnam,Hồ Chí Minh,Thương lượng,"Infrastructure, Automation, PLC, Network, Systems Architecture",Vietnamworks
SAP ABAP Developer,software developer,Intermediate,4,Golden Gate Trade & Service JSC,Hà Nội,Thương lượng,"SAP, ABAP, SAP HANA, FICO, API",Vietnamworks
Senior Full Stack Java Web Developer,full stack developer,Intermediate,4,Navigos Search's Client,Hà nội,$816.33-1632.65,"Java, Spring, VueJS, Microservices, English Communication",Vietnamworks
[Hot Job] Chuyên Gia Công Nghệ Thanh Toán,data scientist,Senior,5,Công Ty Cổ Phần Thanh Toán Quốc Gia Việt Nam,Hà Nội,Thương lượng,"Công Nghệ Thông Tin, Tiếng Anh, Thanh Toán Thẻ, Phát Triển Sản Phẩm, Thanh Toán Điện Tử",Vietnamworks
Chuyên Gia Phát Triển Dịch Vụ (API) - Khối Ngân Hàng Số - (Ho24.279),backend developer,Any Level,N/A,Ngân Hàng Thương Mại Cổ Phần Quân Đội - MB,Hà nội,Thương lượng,"Tài chính Ngân hàng, Giải Pháp Công Nghệ, Tư Vấn Dịch Vụ, API, Thanh Toán Điện Tử",Vietnamworks
Database Administrator,database administrator,Intermediate,3,TL Consulting VN Co. Ltd,Hồ Chí Minh,Thương lượng,"Oracle Database Knowledge, DBA, Computer Hardware Troubleshooting, Software Troubleshooting, Computer Science",Vietnamworks
Data Engineer Consultant,data engineer,Any Level,N/A,Chi Nhánh Công Ty TNHH KPMG,Hồ Chí Minh,Thương lượng,"Data Architecture, Data analysis, Data Models, Data Mining, Big Data",Vietnamworks
Nhân Viên IT,IT professional,Any Level,N/A,"Adtec Plasma Technology Vietnam Co., Ltd",Bắc Ninh,Thương lượng,"Công Nghệ Thông Tin, Microsoft Office 365, Python, C#, ASP.NET",Vietnamworks
Chuyên Viên IT,IT professional,Any Level,N/A,"Trường Quản Trị Và Kinh Doanh, ĐHQGHN",Hà Nội,Thương lượng,"IT System Administration, IT Helpdesk, IT Administration, Helpdesk, Công Nghệ Thông Tin",Vietnamworks
"(JP-86) Thiết Kế Hệ Thống, Phát Triển Chương Trình",data engineer,Junior,2,Công Ty TNHH R Techno Việt Nam,Hồ Chí Minh,$2275.00-2600.00,"Phát Triển Dự Án, SQL Server, SQL Server, Thiết Kế Hệ Thống, Tiếng Nhật, VB.NET",Vietnamworks
End User Technology Specialist,IT professional,Senior,5,RMIT University Vietnam,Hồ Chí Minh,$1347.51,"Customer Service, End User Support, Hệ Thống Active Directory, IT Service Management, Microsoft Office 365",Vietnamworks
Chuyên Viên Quản Trị Hệ Thống và Bảo Mật,system administrator,Junior,2,Hyundai Thành Công Việt Nam (Hyundai.thanhcong.vn),Hà Nội,Thương lượng,"Hệ Thống Mạng, Bảo Mật Dữ Liệu, Giải Pháp Công Nghệ, Điện Tử Viễn Thông, VMware",Vietnamworks
Chuyên Viên Quản Trị Cơ Sở Dữ Liệu (DBA),database administrator,Any Level,N/A,Ngân Hàng TMCP Xuất Nhập Khẩu Việt Nam (Eximbank),Hồ Chí Minh,$1000.00-2000.00,"SLA Control, Công nghệ thông tin, Quản Trị Hệ Thống CNTT",Vietnamworks
Bridge Project Manager (BPM),project manager,Junior,2,Vitalify Asia,Hồ Chí Minh,$2500.00,"Project Management, Japanese N2, DevOps, Kaizen",Vietnamworks
"(Night shift) Implementation Specialist (EDI, ERP, SAP, Supply chain)",data scientist,Junior,1,"Truecommerce Vietnam Company, Limited",Hồ Chí Minh,Thương lượng,"business analyst, Client Service, Customer Service Training, Project Management, Service Implementation",Vietnamworks
BrSE (in Vietnam or Japan),data scientist,Intermediate,3,Hitachi Digital Services,Hồ Chí Minh,Thương lượng,"Japanese Speaking, BrSE, Software Development Life Cycle (SDLC), Agile, English",Vietnamworks
Project Manager,project manager,Senior,5,Mirae Asset Finance Company (Viet Nam) Ltd.,Hồ Chí Minh,Thương lượng,"Quản Lý Dự Án, Project Management, IT Project Management, Core Banking Development",Vietnamworks
Business Intelligence Analyst,business intelligence analyst,Junior,2,"TrueCommerce Dicentral Vietnam Company, Limited",Hồ Chí Minh,Thương lượng,"Data Analytics, Data Visualization, English, Power Automate, PowerBI, PowerBI",Vietnamworks
Database Developer,software developer,Senior,5,Công Ty TNHH ActsOne Việt Nam,Hồ Chí Minh,Thương lượng,"Database Technology, Mysql, MongoDB, Lập Trình, Sql Queries",Vietnamworks
Senior .NET Engineer (Windows Application),software engineer,Intermediate,3,Koidra,Hồ Chí Minh,Thương lượng,"C#, Application Development, WPF, NUnit, Analytical Skills",Vietnamworks
Chuyên Viên Kiểm Thử Phần Mềm,embedded systems engineer,Any Level,N/A,Công Ty Chứng Khoán Yuanta Việt Nam,Hồ Chí Minh,$81.63-897.96,"Viết Test Case, Kiểm Thử Phần Mềm, Chứng khoán, Quản lý chất lượng, Test",Vietnamworks
Game Tester,game developer,Junior,1,Athena Studio,Hồ Chí Minh,$400.00-500.00,"Qa/Qc/Testing Experience, Bug Report Writing, Test Case Writing, Agile Methodology, Game Testing",Vietnamworks
