Job Title,Role,Level,Company,Year Of Experiences,Location,Salary Range,Required Skills,Source Platform
Chuyên Viên Quản Trị Hệ Thống và Bảo Mật,Chuyên Viên Quản Trị Hệ Thống và Bảo Mật,N/A,Hyundai Thành Công Việt Nam (Hyundai.thanhcong.vn),2 năm kinh nghiệm,"Thành Công Tower, 79 Dịch Vọng Hậu, Cầu Giấy, Hà Nội",Thương lượng,"Hệ Thống Mạng, Bảo Mật Dữ Liệu, Giải Pháp Công Nghệ, Điện Tử Viễn Thông, VMware",https://www.vietnamworks.com/chuyen-vien-quan-tri-he-thong-va-bao-mat--1830525-jv?source=searchResults&searchType=2&placement=1830625&sortBy=date
Chuyên Viên Quản Trị Cơ Sở Dữ Liệu (DBA),Chuyên Viên Quản Trị Cơ Sở Dữ Liệu DBA,N/A,Ngân Hàng TMCP Xuất Nhập Khẩu Việt Nam (Eximbank),Không yêu cầu năm kinh nghiệm,"Tầng 8, tòa nhà Vincom center, số 72 Lê Thánh Tôn và 45A Lý Tự Trọng, Quận 1, TP.HCM","$ 1,000-2,000 /tháng","SLA Control, Công nghệ thông tin, Quản Trị Hệ Thống CNTT",https://www.vietnamworks.com/chuyen-vien-quan-tri-co-so-du-lieu-dba--1840855-jv?source=searchResults&searchType=2&placement=1841005&sortBy=date
Bridge Project Manager (BPM),Bridge Project Manager BPM,N/A,Vitalify Asia,2 năm kinh nghiệm,"224A-224B Điện Biên Phủ, Phường Võ Thị Sáu, Quận 3, Tp. HCM","Tới $ 2,500 /tháng","Project Management, Japanese N2, DevOps, Kaizen",https://www.vietnamworks.com/bridge-project-manager-bpm-1839407-jv?source=searchResults&searchType=2&placement=1839657&sortBy=date
"(Night shift) Implementation Specialist (EDI, ERP, SAP, Supply chain)","Night shift Implementation Specialist EDI, ERP, SAP, Supply chain",N/A,"Truecommerce Vietnam Company, Limited",1 năm kinh nghiệm,"Helios Building, Quang Trung Software Complex, District 12",Thương lượng,"business analyst, Client Service, Customer Service Training, Project Management, Service Implementation",https://www.vietnamworks.com/-night-shift-implementation-specialist-edi-erp-sap-supply-chain-1842760-jv?source=searchResults&searchType=2&placement=1842860&sortBy=date
BrSE (in Vietnam or Japan),BrSE in Vietnam or Japan,N/A,Hitachi Digital Services,3 năm kinh nghiệm,"Floor 3rd, 4th Helios Building - Floor 9th QTSC9 Building, Quang Trung Software City, Tan Chanh Hiep Ward, District 12",Thương lượng,"Japanese Speaking, BrSE, Software Development Life Cycle (SDLC), Agile, English",https://www.vietnamworks.com/brse-in-vietnam-or-japan-1841900-jv?source=searchResults&searchType=2&placement=1842000&sortBy=date
Project Manager,Project Manager,N/A,Mirae Asset Finance Company (Viet Nam) Ltd.,5 năm kinh nghiệm,"1st Floor, SaiGon Royal, 91 Pasteur, Ben Nghe Ward, District 1",Thương lượng,"Quản Lý Dự Án, Project Management, IT Project Management, Core Banking Development",https://www.vietnamworks.com/project-manager--1844083-jv?source=searchResults&searchType=2&placement=1844533&sortBy=date
Business Intelligence Analyst,Business Intelligence Analyst,N/A,"TrueCommerce Dicentral Vietnam Company, Limited",2 năm kinh nghiệm,"Helios Building, Quang Trung Software Complex, District 12",Thương lượng,"Data Analytics, Data Visualization, English, Power Automate, PowerBI, PowerBI",https://www.vietnamworks.com/business-intelligence-analyst-1842467-jv?source=searchResults&searchType=2&placement=1842617&sortBy=date
Database Developer,Database Developer,N/A,Công Ty TNHH ActsOne Việt Nam,5 năm kinh nghiệm,"Số 20 Đường 01, Khu Đô Thị Mới Him Lam, Phường Tân Hưng, Quận 7, Thành Phố Hồ Chí Minh",Thương lượng,"Database Technology, Mysql, MongoDB, Lập Trình, Sql Queries",https://www.vietnamworks.com/database-developer--1840741-jv?source=searchResults&searchType=2&placement=1841241&sortBy=date
Senior .NET Engineer (Windows Application),Senior .NET Engineer Windows Application,['Senior'],Koidra,3 năm kinh nghiệm,"500 Yale Ave N, Seattle, WA 98109",Thương lượng,"C#, Application Development, WPF, NUnit, Analytical Skills",https://www.vietnamworks.com/senior-net-engineer-windows-application-1837513-jv?source=searchResults&searchType=2&placement=1837613&sortBy=date
Chuyên Viên Kiểm Thử Phần Mềm,Chuyên Viên Kiểm Thử Phần Mềm,N/A,Công Ty Chứng Khoán Yuanta Việt Nam,Không yêu cầu năm kinh nghiệm,"Tầng 4, Tòa Nhà Saigon Centre, 65 Lê Lợi, Quận 1, TP. HCM",2tr-22tr ₫/tháng,"Viết Test Case, Kiểm Thử Phần Mềm, Chứng khoán, Quản lý chất lượng, Test",https://www.vietnamworks.com/chuyen-vien-kiem-thu-phan-mem-1841947-jv?source=searchResults&searchType=2&placement=1842197&sortBy=date
Game Tester,Game Tester,N/A,Athena Studio,1 năm kinh nghiệm,"40A Lam Sơn, Phường 2, Quận Tân Bình, TPHCM",$ 400-500 /tháng,"Qa/Qc/Testing Experience, Bug Report Writing, Test Case Writing, Agile Methodology, Game Testing",https://www.vietnamworks.com/game-tester-1842850-jv?source=searchResults&searchType=2&placement=1843100&sortBy=date
Information Service (IS) Engineer,Information Service IS Engineer,N/A,"TRIPOD VIETNAM (BIENHOA) ELECTRONIC CO., LTD.",1 năm kinh nghiệm,"No. 31, Street 3A, Bien Hoa Industrial Zone II, Dong Nai Province",Thương lượng,"Network Administration, CCNA, Cyber Security, Firewall, Linux",https://www.vietnamworks.com/information-service-is-engineer-1824775-jv?source=searchResults&searchType=2&placement=1825125&sortBy=date
Senior Data Analyst,Senior Data Analyst,['Senior'],Capgemini Vietnam,1 năm kinh nghiệm,"Centre Point, 106 Nguyen Van Troi",Thương lượng,"Python, SQL, Data Analysis, ETL, Computer Science",https://www.vietnamworks.com/senior-data-analyst--1840704-jv?source=searchResults&searchType=2&placement=1840704&sortBy=date
Manual Tester,Manual Tester,N/A,FPT Software,2 năm kinh nghiệm,"[HCM]Lô T2, đường D1, khu Công nghệ cao, Quận 9, Tp.Hồ Chí Minh; [HN]Tòa nhà FPT, 17 Duy Tân, Cầu Giấy, Hà Nội; [DN] Tòa Nhà FPT Complex, Đường Nam Kỳ Khởi Nghĩa, Phường Hoà Hải, Quận Ngũ Hành Sơn, TP Đà Nẵng",Thương lượng,"Manual Testing, API Testing, SQL, Test execution, Postman",https://www.vietnamworks.com/manual-tester--1844903-jv?source=searchResults&searchType=2&placement=1844953&sortBy=date
Senior QC Engineer,Senior QC Engineer,['Senior'],Công Ty TNHH Công Nghệ Và Giải Pháp Phần Mềm Crossian,5 năm kinh nghiệm,"Tầng 1, Pax Sky, 63-65 Ngô Thì Nhậm, Phường Phạm Đình Hổ, Quận Hai Bà Trưng, TP Hà Nội, Việt Nam",Thương lượng,"AWS Cloud, CI/CD, English, Quality Assurance",https://www.vietnamworks.com/senior-qc-engineer-1835733-jv?source=searchResults&searchType=2&placement=1835983&sortBy=date
Regional Information Security Officer for Viet Nam and Laos,Regional Information Security Officer for Viet Nam and Laos,N/A,The Deutsche Gesellschaft Für Internationale Zusammenarbeit (Giz),5 năm kinh nghiệm,"6th Floor – Hanoi Towers, 49 Hai Ba Trung, Hanoi",Thương lượng,"English, Information security, ISO, Risk Management, System Management",https://www.vietnamworks.com/regional-information-security-officer-for-viet-nam-and-laos-1837445-jv?source=searchResults&searchType=2&placement=1837845&sortBy=date
IT Server Engineer,IT Server Engineer,N/A,Navigos Search's Client,2 năm kinh nghiệm,Hanoi,20tr-35tr ₫/tháng,"English Communication, Linux System Administration, Server Management, VMware, Windows Server",https://www.vietnamworks.com/it-server-engineer-1836055-jv?source=searchResults&searchType=2&placement=1836755&sortBy=date
Embedded Test Lead (Joining Bonus),Embedded Test Lead Joining Bonus,N/A,Bosch Global Software Technologies Company Limited,5 năm kinh nghiệm,"Etown 2, 364 Cong Hoa street, ward 13, Tan Binh district, HCM",Thương lượng,"Analytical skills, English communication, Embedded Test Lead, Automation system test, SW process test",https://www.vietnamworks.com/embedded-test-lead-joining-bonus-1838221-jv?source=searchResults&searchType=2&placement=1838271&sortBy=date
Join The Ocean Villas As A IT Officer,Join The Ocean Villas As A IT Officer,N/A,The Ocean Villas At The Ocean Resort,2 năm kinh nghiệm,"Hoa Hai Ward, Ngu Hanh Son District, Danang city",Thương lượng,"System Administration, SQL Server, Technical Management, Windows Server, Backup",https://www.vietnamworks.com/join-the-ocean-villas-as-a-it-officer-1838154-jv?source=searchResults&searchType=2&placement=1838454&sortBy=date
"Back-end Developers (.Net Core, C#)","Back-end Developers .Net Core, C#",N/A,Công Ty TNHH GVI HCM,1 năm kinh nghiệm,"43/11-13 Hậu Giang, Phường 4, Quận Tân Bình, TP HCM","$ 1,000-2,000 /tháng",".Net Core, C#, Entity Framework, Troubleshooting, Asp.Net Web Api",https://www.vietnamworks.com/back-end-developers-net-core-c-1835235-jv?source=searchResults&searchType=2&placement=1835835&sortBy=date
Business Analyst - Khối Dữ Liệu (Ho24.296),Business Analyst - Khối Dữ Liệu Ho24.296,N/A,Ngân Hàng Thương Mại Cổ Phần Quân Đội - MB,3 năm kinh nghiệm,"19th – MB Building,18 Le Van Luong Str., Cau Giay Dist. Hanoi, Vietnam",Thương lượng,"Business analysis, Công Nghệ Thông Tin, Oracle, SQL",https://www.vietnamworks.com/business-analyst-khoi-du-lieu-ho24-296-1842179-jv?source=searchResults&searchType=2&placement=1842429&sortBy=date
Engineering Manager,Engineering Manager,N/A,Công Ty TNHH Công Nghệ Và Giải Pháp Phần Mềm Crossian,Không yêu cầu năm kinh nghiệm,"Tầng 1, Pax Sky, 63-65 Ngô Thì Nhậm, Phường Phạm Đình Hổ, Quận Hai Bà Trưng, TP Hà Nội, Việt Nam",Thương lượng,"Cloud Technologies, Project Management, Software Development, Agile, Product Development",https://www.vietnamworks.com/engineering-manager--1843655-jv?source=searchResults&searchType=2&placement=1843855&sortBy=date
MIS Engineer - Kỹ Sư Công Nghệ Thông Tin (Work In Phu Yen),MIS Engineer - Kỹ Sư Công Nghệ Thông Tin Work In Phu Yen,N/A,CCIPY Vietnam,3 năm kinh nghiệm,"Khu Công Nghiệp An Phú, Phú Yên",Thương lượng,"Wireless Network, ADSL, LAN, Cài Đặt Phần Mềm, Bảo Trì",https://www.vietnamworks.com/mis-engineer-ky-su-cong-nghe-thong-tin-work-in-phu-yen--1838259-jv?source=searchResults&searchType=2&placement=1838559&sortBy=date
Business Analyst (Membership Program Builder),Business Analyst Membership Program Builder,N/A,TPF Group,3 năm kinh nghiệm,"Unit D3-1, 3rd floor, Standard Factory D, Lot Va.04b located on Road 24 & 17, Industrial Park within Tan Thuan Export Processing Zone, Tan Thuan Dong Ward, District 7, Ho Chi Minh",Thương lượng,"E-commerce, Data Structure, English fluency, Business analysis, System Integration",https://www.vietnamworks.com/business-analyst-membership-program-builder--1831464-jv?source=searchResults&searchType=2&placement=1831714&sortBy=date
IT Application Support Senior/ Leader (IT Hỗ Trợ Phần Mềm),IT Application Support Senior/ Leader IT Hỗ Trợ Phần Mềm,['Senior'],Công Ty Cổ Phần Tập Đoàn Golden Gate,3 năm kinh nghiệm,"Tầng 6, tòa nhà Toyota Thanh Xuân, 315 Trường  Chinh, Hà Nội",Thương lượng,"SQL, Application Support, MySQL Server, IT Support, IT Software",https://www.vietnamworks.com/it-application-support-senior-leader-it-ho-tro-phan-mem--1840580-jv?source=searchResults&searchType=2&placement=1841080&sortBy=date
Chuyên Viên Cao Cấp Vận Hành Ứng Dụng Công Nghệ Thông Tin,Chuyên Viên Cao Cấp Vận Hành Ứng Dụng Công Nghệ Thông Tin,N/A,Công Ty Cổ Phần Chứng Khoán Vndirect,4 năm kinh nghiệm,"HO: Số 1 Nguyễn Thượng Hiền, Hai Bà Trưng, Hà Nội. CN.HCM:  90 Pasteur, P. Bến Nghé, Q1",Thương lượng,"IT System Administration, Công Nghệ Thông Tin, Tài Chính Ngân Hàng, Tiếng Anh",https://www.vietnamworks.com/chuyen-vien-cao-cap-van-hanh-ung-dung-cong-nghe-thong-tin-1842181-jv?source=searchResults&searchType=2&placement=1842481&sortBy=date
Senior Front End Developer (Web and Mobile),Senior Front End Developer Web and Mobile,['Senior'],Arctx Solution LLC,Không yêu cầu năm kinh nghiệm,"F7th, B tower of Epic building, Lane 19 Duy Tan, Cau Giay, Ha Noi",Thương lượng,"JavaScript, React Native, ReactJs, Redux, Angular",https://www.vietnamworks.com/senior-front-end-developer-web-and-mobile-1842580-jv?source=searchResults&searchType=2&placement=1842930&sortBy=date
Trưởng Phòng Cấp Cao Cơ Sở Hạ Tầng CNTT/ IT Infrastructure Senior Manager,Trưởng Phòng Cấp Cao Cơ Sở Hạ Tầng CNTT/ IT Infrastructure Senior Manager,['Senior'],Công Ty TNHH TM DV Tân Hiệp Phát,10 năm kinh nghiệm,"219 Đại lộ Bình Dương, Vĩnh Phú, Thuận An, Bình Dương",Thương lượng,"Infrastructure Management, Risk Management, Cloud Infrastructure, Security, Infrastructure Security",https://www.vietnamworks.com/truong-phong-cap-cao-co-so-ha-tang-cntt-it-infrastructure-senior-manager-1842884-jv?source=searchResults&searchType=2&placement=1843484&sortBy=date
Product Analyst,Product Analyst,N/A,Vinhms,3 năm kinh nghiệm,"Số 16-18  Đường số 65, Phường Thảo Điền, Thành phố Thủ Đức, thành phố Hồ Chí Minh",Thương lượng,"Product Analyst, Critical Thinking, Communication Skills, business analyst, Product Application",https://www.vietnamworks.com/product-analyst--1835339-jv?source=searchResults&searchType=2&placement=1835939&sortBy=date
Process Analyst,Process Analyst,N/A,Home Credit Vietnam - Explore Your Dream Team,Không yêu cầu năm kinh nghiệm,"Phu Nu Building, 20 Nguyen Dang Giai, Thao Dien Ward, District 2, HCMC",Thương lượng,"Project Management, Process Analysis, Business Analysis, Business Process Transformation, Audit",https://www.vietnamworks.com/process-analyst--1842572-jv?source=searchResults&searchType=2&placement=1842972&sortBy=date
Software Expert (Java/Springboot),Software Expert Java/Springboot,N/A,Navigos Search's Client,8 năm kinh nghiệm,Hanoi,"$ 3,000-3,500 /tháng","Agile, Project Management, Software Development, Team Development, Technical Management",https://www.vietnamworks.com/software-expert-javaspringboot-1838058-jv?source=searchResults&searchType=2&placement=1838758&sortBy=date
Senior Frontend Reactjs Developer (French Speaking),Senior Frontend Reactjs Developer French Speaking,['Senior'],Capgemini Vietnam,4 năm kinh nghiệm,"Centre Point, 106 Nguyễn Văn Trỗi, Phường 08, Quận Phú Nhuận, Thành phố Hồ Chí Minh",Thương lượng,"French, Redux, Workflow, ReactJS, JavaScript",https://www.vietnamworks.com/senior-frontend-reactjs-developer-french-speaking--1843126-jv?source=searchResults&searchType=2&placement=1843176&sortBy=date
JavaScript Developer (Web3 Focus),JavaScript Developer Web3 Focus,N/A,Terminus,1 năm kinh nghiệm,N/A,"$ 2,000-4,000 /tháng","Database Design, JavaScript, Node.js, Smart Contract Development, Web3 Technologies",https://www.vietnamworks.com/javascript-developer-web3-focus-1824788-jv?source=searchResults&searchType=2&placement=1825388&sortBy=date
Product Specialist,Product Specialist,N/A,Reversal,4 năm kinh nghiệm,"Vinhome Central Park, 208 Nguyen Huu Canh, Ward 22, Binh Thanh District, Ho Chi Minh City",Thương lượng,"Technical Lead, Agile, Mobile Platform, Market Research, Project Management",https://www.vietnamworks.com/product-specialist-1840206-jv?source=searchResults&searchType=2&placement=1840706&sortBy=date
Data Scientist - Khối Dữ Liệu (Holt.01),Data Scientist - Khối Dữ Liệu Holt.01,N/A,Ngân Hàng Thương Mại Cổ Phần Quân Đội - MB,3 năm kinh nghiệm,"19th – MB Building,18 Le Van Luong Str., Cau Giay Dist. Hanoi, Vietnam",Thương lượng,"Data Analysis, Data Mining, Machine Learning, Python, Scala",https://www.vietnamworks.com/data-scientist-khoi-du-lieu-holt-01-1842085-jv?source=searchResults&searchType=2&placement=1842185&sortBy=date
Nhân Viên Tư Vấn Kỹ Thuật (Ngành Nghề CNTT Điện Tử Viễn Thông),Nhân Viên Tư Vấn Kỹ Thuật Ngành Nghề CNTT Điện Tử Viễn Thông,N/A,Công Ty TNHH MTV Ứng Dụng Kỹ Thuật Và Sản Xuất,2 năm kinh nghiệm,"Tòa nhà CIT ngõ 15 Duy Tân, Dịch Vọng Hậu, Cầu Giấy, Hà Nội",Từ $ 500 /tháng,"Tư Vấn Kỹ Thuật, Viễn Thông, Điện tử viễn thông, Công nghệ thông tin",https://www.vietnamworks.com/nhan-vien-tu-van-ky-thuat-nganh-nghe-cntt-dien-tu-vien-thong-1835935-jv?source=searchResults&searchType=2&placement=1836485&sortBy=date
IT Staff,IT Staff,N/A,CÔNG TY TNHH POLIFILM VIỆT NAM,3 năm kinh nghiệm,"Bến Cát, Bình Dương",Thương lượng,"ERP, Information Technology, LAN, Network Systems, VPN",https://www.vietnamworks.com/it-staff-1836341-jv?source=searchResults&searchType=2&placement=1836891&sortBy=date
IT Specialist,IT Specialist,N/A,Công Ty CP Tập Đoàn Công Nghệ CMC,6 năm kinh nghiệm,"Tầng 17, Tòa nhà CMC, Phố Duy Tân, Dịch Vọng Hậu, Hà Nội",Thương lượng,"IT Audit, IT Infrastructure, User Support",https://www.vietnamworks.com/it-specialist-1836300-jv?source=searchResults&searchType=2&placement=1836850&sortBy=date
Cloud Account Manager,Cloud Account Manager,N/A,Megazone Vietnam Company Limited,3 năm kinh nghiệm,"Lotte Center Hà Nội, 54 Liễu Giai, Cống Vị, Ba Đình, Hà Nội",Thương lượng,"Salesforce, Salesforce Development, Cloud, Visualforce, SQL",https://www.vietnamworks.com/cloud-account-manager-1840142-jv?source=searchResults&searchType=2&placement=1840492&sortBy=date
IT Associate Manager,IT Associate Manager,N/A,Perfetti Van Melle (Viet Nam) Limited,5 năm kinh nghiệm,"Lot N, Street No.26, Song Than Industrial Zone No.2, Di An District, Binh Duong Province",Thương lượng,"Analytical Skills, Communication Skills, Implementing Business Software, Project Management, SAP ERP",https://www.vietnamworks.com/it-associate-manager-1842321-jv?source=searchResults&searchType=2&placement=1842571&sortBy=date
DevOps Engineer,DevOps Engineer,N/A,i3 DVR International Inc.,3 năm kinh nghiệm,"No. 30 Ap Bac Street, Ward 13, District Tan Binh, HCM City",Thương lượng,"AWS Services, Docker, SQL, DevOps, Docker, Docker, Information Technology",https://www.vietnamworks.com/devops-engineer-1838269-jv?source=searchResults&searchType=2&placement=1838319&sortBy=date
Head of IT/ CS Department _ Swinburne HCM Campus (Master Degree or Higher Required),Head of IT/ CS Department _ Swinburne HCM Campus Master Degree or Higher Required,N/A,Swinburne Vietnam (HCMC),Không yêu cầu năm kinh nghiệm,"A35 Bach Dang Street, Ward 2, Tan Binh District, Ho Chi Minh City","$ 1,500-3,000 /tháng","Khoa Học Máy Tính, Giáo Dục Đào Tạo, Giảng Dạy, Công Nghệ Thông Tin, AI",https://www.vietnamworks.com/head-of-it-cs-department-swinburne-hcm-campus-master-degree-or-higher-required-1837803-jv?source=searchResults&searchType=2&placement=1838203&sortBy=date
Chuyên Gia An Ninh Thông Tin – Hà Nội – RM,Chuyên Gia An Ninh Thông Tin – Hà Nội – RM,N/A,VPBank - Https://tuyendung.vpbank.com.vn/,7 năm kinh nghiệm,"Khối Quản Trị Nguồn Nhân Lực - 89 Láng Hạ, Quận Đống Đa, Hà Nội",Thương lượng,"An Ninh Mạng, An Toàn Thông Tin, Bảo Mật Thông Tin, Công nghệ thông tin",https://www.vietnamworks.com/chuyen-gia-an-ninh-thong-tin-ha-noi-rm-1840595-jv?source=searchResults&searchType=2&placement=1840745&sortBy=date
Trưởng Phòng Kỹ Thuật,Trưởng Phòng Kỹ Thuật,N/A,OPTIMA ROBOTICS COMPANY,Không yêu cầu năm kinh nghiệm,N/A,Thương lượng,"Arduino, Arduino, Arduino, C#, Python, Robot Control Programming, STM32, STM32",https://www.vietnamworks.com/truong-phong-ky-thuat-1844357-jv?source=searchResults&searchType=2&placement=1844507&sortBy=date
BI Database Developer,BI Database Developer,N/A,Công Ty TNHH Xsunt,2 năm kinh nghiệm,"Phòng 907 tòa nhà Miss Áo Dài, 21 Nguyễn Trung Ngạn, Phường Bến Nghé, Quận 1, TP Hồ Chí Minh, Việt Nam","$ 1,000-1,500 /tháng","MS SQL, Database Administration, Java, database management, Data Analytics",https://www.vietnamworks.com/bi-database-developer--1842380-jv?source=searchResults&searchType=2&placement=1842980&sortBy=date
Ruby On Rails Developer,Ruby On Rails Developer,N/A,GSM,Không yêu cầu năm kinh nghiệm,"Symphony Office, đường Chu Huy Mân, Long Biên, Hà Nội","$ 1,000-3,000 /tháng","Ruby On Rails, OOP, MySQL, Python, PostgreSQL",https://www.vietnamworks.com/ruby-on-rails-developer--1836636-jv?source=searchResults&searchType=2&placement=1836836&sortBy=date
Senior Business Analyst Technical,Senior Business Analyst Technical,['Senior'],Công Ty Cổ Phần Sữa VitaDairy Việt Nam,3 năm kinh nghiệm,"Trụ sở chính tại HCM: Tầng 5, Số 37 Tôn Đức Thắng, P. Bến Nghé, Quận 1, HCM/ VP. Hà Nội: Toà nhà CT1 - The Zen Residence, Khu đô thị C2 - Gamuda Gardens, Phường Trần Phú, Quận Hoàng Mai, Hà Nộ",Thương lượng,"Kiểm Thử Tính Năng, Kỹ năng nắm bắt và giải quyết vấn đề, Làm Việc Nhóm, Mô Phỏng Phân Tích, Phân Tích Nghiệp Vụ",https://www.vietnamworks.com/senior-business-analyst-technical-1843021-jv?source=searchResults&searchType=2&placement=1843621&sortBy=date
IT/ CS Full-Time Lecturers (Master Degree or Higher Required),IT/ CS Full-Time Lecturers Master Degree or Higher Required,N/A,Swinburne Vietnam (HCMC),Không yêu cầu năm kinh nghiệm,"A35 Bach Dang Street, Ward 2, Tan Binh District, Ho Chi Minh City","$ 1,000-2,000 /tháng","Phần Cứng Mạng, Khoa Học Máy Tính, IT Administration, Giáo Dục, Công Nghệ Thông Tin",https://www.vietnamworks.com/it-cs-full-time-lecturers-master-degree-or-higher-required-1837799-jv?source=searchResults&searchType=2&placement=1838149&sortBy=date
Chuyên Viên Front End,Chuyên Viên Front End,N/A,Công Ty Cổ Phần Chứng Khoán KB Việt Nam,3 năm kinh nghiệm,"Tầng 16 và 17, Tháp 02 tòa nhà Capital Place, Số 29 Liễu Giai, phường Ngọc Khánh, quận Ba Đình, Hà Nội","$ 500-1,000 /tháng","Front-End, JavaScript, AngularJS, CSS, RestAPI",https://www.vietnamworks.com/chuyen-vien-front-end--1841849-jv?source=searchResults&searchType=2&placement=1841949&sortBy=date
"Chuyên Viên Phụ Trách Ứng Dụng Công Nghệ, Phần Mềm Trong Doanh Nghiệp (Kỹ Sư Phần Mềm, Lập Trình Viên…)","Chuyên Viên Phụ Trách Ứng Dụng Công Nghệ, Phần Mềm Trong Doanh Nghiệp Kỹ Sư Phần Mềm, Lập Trình Viên…",N/A,Công Ty Du Học Du Lịch TMDV Á Âu,3 năm kinh nghiệm,"52 Trần Huy Liệu, P.11, Q. Phú Nhuận, TP.HCM",Thương lượng,"Công Nghệ Thông Tin, Khoa Học Máy Tính, ERP, AI, Giám Sát Hệ Thống",https://www.vietnamworks.com/chuyen-vien-phu-trach-ung-dung-cong-nghe-phan-mem-trong-doanh-nghiep-ky-su-phan-mem-lap-trinh-vien--1842799-jv?source=searchResults&searchType=2&placement=1843099&sortBy=date
[Canon Tiên Sơn] Nhân Viên IT,Canon Tiên Sơn Nhân Viên IT,N/A,Công Ty TNHH Canon Việt Nam,Không yêu cầu năm kinh nghiệm,"Lô A1, KCN Thăng Long, Kim Chung, Đông Anh, Hà Nội",Thương lượng,"IT Phần Mềm, Công Nghệ Thông Tin, Điện Tử Viễn Thông, Khoa Học Máy Tính",https://www.vietnamworks.com/canon-tien-son-nhan-vien-it--1843389-jv?source=searchResults&searchType=2&placement=1843939&sortBy=date
Senior Full Stack Java Developer,Senior Full Stack Java Developer,['Senior'],Arctx Solution LLC,Không yêu cầu năm kinh nghiệm,"F7th, B tower of Epic building, Lane 19 Duy Tan, Cau Giay, Ha Noi",Thương lượng,"ReactJS, Java, Full Stack Development, JavaScript",https://www.vietnamworks.com/senior-full-stack-java-developer--1839937-jv?source=searchResults&searchType=2&placement=1840437&sortBy=date
"Chuyên Gia Quản Lý Rủi Ro An Ninh Thông Tin Cấp 2, Phòng Quản Trị Rủi Ro Hoạt Động, Khối Quản Trị Rủi Ro","Chuyên Gia Quản Lý Rủi Ro An Ninh Thông Tin Cấp 2, Phòng Quản Trị Rủi Ro Hoạt Động, Khối Quản Trị Rủi Ro",N/A,Ngân Hàng TMCP Đại Chúng Việt Nam,4 năm kinh nghiệm,Số 22 Ngô Quyền - Hà Nội - Việt Nam,"$ 1,000-2,000 /tháng","IT Security, Quản Trị Rủi Ro Thông Tin, An Ninh Dữ Liệu, Bảo Mật Dữ Liệu, An Ninh Thông Tin",https://www.vietnamworks.com/chuyen-gia-quan-ly-rui-ro-an-ninh-thong-tin-cap-2-phong-quan-tri-rui-ro-hoat-dong-khoi-quan-tri-rui-ro--1839399-jv?source=searchResults&searchType=2&placement=1839549&sortBy=date
Senior IT Supervisor,Senior IT Supervisor,['Senior'],Minthacare Vietnam,2 năm kinh nghiệm,"5th Floor, 119-121 Ung Van Khiem, Ward 25, Binh Thanh District",Thương lượng,"Computer Science, ERP, IT Infrastructure Operations, SOP Development, IT Service Management",https://www.vietnamworks.com/senior-it-supervisor-1839857-jv?source=searchResults&searchType=2&placement=1840007&sortBy=date
Trưởng Nhóm Phát Triển,Trưởng Nhóm Phát Triển,N/A,Taixin Printing VINA,5 năm kinh nghiệm,"Số 6, đường TS3, KCN Tiên Sơn, Xã Hoàn Sơn, Tiên Du, Bắc Ninh",100-500 ₫/tháng,"MS SQL, DevExpress, C#",https://www.vietnamworks.com/truong-nhom-phat-trien-1839858-jv?source=searchResults&searchType=2&placement=1840258&sortBy=date
Senior Business Analyst,Senior Business Analyst,['Senior'],Endava Việt Nam,8 năm kinh nghiệm,"No. 9 – 11 Dong Da street, ward 2, Tan Binh district, Ho Chi Minh city",Thương lượng,"Agile, Business Analysis, Data Analysis, Scrum, Leadership",https://www.vietnamworks.com/senior-business-analyst--1841457-jv?source=searchResults&searchType=2&placement=1842107&sortBy=date
