Job Title,Role,Level,Company,Year Of Experiences,Location,Salary Range,Required Skills,Source Platform
IT Security Engineer,IT Security Engineer,N/A,Sabeco - Tổng Công Ty Cổ Phần Bia - Rượu - Nước Giải Khát Sài Gòn,Không yêu cầu năm kinh nghiệm,"Lầu 5 VincomB, 45 A Lý Tự Trọng, Bến Nghé, Quận 1, Hồ Chí Minh",Thương lượng,"IT Security, IT Governance, Cyber Risk Management, IT Operations, Network Technology",https://www.vietnamworks.com/it-security-engineer-8-1--1855758-jv?source=searchResults&searchType=2&placement=1855758&sortBy=latest
Experienced Automation Tester,Experienced Automation Tester,N/A,Capgemini Vietnam,4 năm kinh nghiệm,"Centre Point, 106 Nguyễn Văn Trỗi, Phường 08, Quận Phú Nhuận, Thành phố Hồ Chí Minh",Thương lượng,"Java, API Testing, Web Automation Testing, Ci/Cd Pipelines, Automation Test Script",https://www.vietnamworks.com/experienced-automation-tester--1852211-jv?source=searchResults&searchType=2&placement=1852411&sortBy=latest
[$4000 - $5000] Software Engineering Manager (Front-End),$4000 - $5000 Software Engineering Manager Front-End,N/A,Navigos Search's Client,5 năm kinh nghiệm,Hanoi,"$ 4,000-5,000 /tháng","Angular, Angular, Angular, Front-End, Kotlin, Swift, Swift, Typescript",https://www.vietnamworks.com/dollar4000-dollar5000-software-engineering-manager-front-end-1847734-jv?source=searchResults&searchType=2&placement=1848234&sortBy=latest
Sharepoint Business Analyst,Sharepoint Business Analyst,N/A,"Rochdale Spears Co., Ltd.",3 năm kinh nghiệm,"207 DT 747A, Tổ 1, Khu phố Tân Lương, Phường Thạnh Phước, Thị xã Tân Uyên, Bình Dương","Từ $ 1,000 /tháng","SharePoint, business analyst, Project Management, Power BI, Power Automate",https://www.vietnamworks.com/sharepoint-business-analyst-1847113-jv?source=searchResults&searchType=2&placement=1847613&sortBy=latest
Application Engineer,Application Engineer,N/A,Ascendas Systems Co. Ltd,3 năm kinh nghiệm,"6th Floor, Sannam Building , 78 Duy Tan Street, Dich Von Hau Ward, Cau Giay District, Hanoi , Vietnam",Thương lượng,"MATLAB, Simulink, Python, Software Development, Engineering",https://www.vietnamworks.com/application-engineer-84--1848103-jv?source=searchResults&searchType=2&placement=1848553&sortBy=latest
Business Assistant,Business Assistant,N/A,Công Ty TNHH Advantech Việt Nam Technology,2 năm kinh nghiệm,"Tầng 12A, toà VTC Online, 18 Tam Trinh, Hai Bà Trưng, HN",11tr-14tr ₫/tháng,"Business Management, CRM Program Management, Data Analysis, PowerBI, PowerBI",https://www.vietnamworks.com/business-assistant-1847622-jv?source=searchResults&searchType=2&placement=1848122&sortBy=latest
UX Designer,UX Designer,N/A,Techcombank,3 năm kinh nghiệm,"Số 6 Quang Trung, phường Trần Hưng Đạo, Quận Hoàn Kiếm, Thành Phố Hà Nội",Thương lượng,"Agile, Software Prototyping, User Experience Development, Visual Design, Workshop Design",https://www.vietnamworks.com/ux-designer-1849433-jv?source=searchResults&searchType=2&placement=1849783&sortBy=latest
Software Team Leader (Upto $1700),Software Team Leader Upto $1700,N/A,Công Ty Cổ Phần Capella Group,5 năm kinh nghiệm,"Tòa nhà Samsora 105 Chu Văn An, Hà Đông, Hà Nội","Tới $ 1,700 /tháng","OOP (Object Oriented Programming), ASP.NET, C#, Entity Framework, .Net",https://www.vietnamworks.com/software-team-leader-upto-1700-1843096-jv?source=searchResults&searchType=2&placement=1843246&sortBy=latest
Automation Software Tester (Selenium/ Java),Automation Software Tester Selenium/ Java,N/A,Bosch Global Software Technologies Company Limited,Không yêu cầu năm kinh nghiệm,"Etown 2, 364 Cong Hoa street, ward 13, Tan Binh district, HCM",Thương lượng,"Java, Selenium",https://www.vietnamworks.com/automation-software-tester-selenium-java--1848985-jv?source=searchResults&searchType=2&placement=1849385&sortBy=latest
Full-Stack Test Manager - Salary Up to $3000,Full-Stack Test Manager - Salary Up to $3000,N/A,FPT Software,8 năm kinh nghiệm,"[HCM]Lô T2, đường D1, khu Công nghệ cao, Quận 9, Tp.Hồ Chí Minh; [HN]Tòa nhà FPT, 17 Duy Tân, Cầu Giấy, Hà Nội; [DN] Tòa Nhà FPT Complex, Đường Nam Kỳ Khởi Nghĩa, Phường Hoà Hải, Quận Ngũ Hành Sơn, TP Đà Nẵng","Tới $ 3,000 /tháng","Software Testing, Java, Selenium, Agile Methodologies, C#",https://www.vietnamworks.com/full-stack-test-manager-salary-up-to-3000-1850523-jv?source=searchResults&searchType=2&placement=1850823&sortBy=latest
[Tuyển Gấp] Kỹ Sư IT (Tiếng Trung/ Anh) IT 工程師 （中文/英文）,Tuyển Gấp Kỹ Sư IT Tiếng Trung/ Anh IT 工程師 （中文/英文）,N/A,Công Ty TNHH Chunghwa Telecom Việt Nam,1 năm kinh nghiệm,"P703, tòa nhà 3D Center, phố Duy Tân, phường Dịch Vọng Hậu, quận Cầu Giấy, Hà Nội",$ 700-900 /tháng,"IT Hardware, WAN, Firewall, Hệ Thống Mạng, Quản Trị Mạng",https://www.vietnamworks.com/tuyen-gap-ky-su-it-tieng-trung-anh-it-xiao-dael-yong-daelg--1848270-jv?source=searchResults&searchType=2&placement=1848720&sortBy=latest
Bridge Project Manager (BPM),Bridge Project Manager BPM,N/A,Vitalify Asia,2 năm kinh nghiệm,"224A-224B Điện Biên Phủ, Phường Võ Thị Sáu, Quận 3, Tp. HCM","Tới $ 2,500 /tháng","Project Management, Japanese N2, DevOps, Kaizen",https://www.vietnamworks.com/bridge-project-manager-bpm--1848829-jv?source=searchResults&searchType=2&placement=1849229&sortBy=latest
Chuyên Viên IT Hạ Tầng,Chuyên Viên IT Hạ Tầng,N/A,Công Ty Cổ Phần Tập Đoàn Thái Bình Dương,1 năm kinh nghiệm,"Tầng 9 số 25 Lý Thường Kiệt, P. Phan Chu Trinh, Q. Hoàn Kiếm, Hà Nội",10tr-15tr ₫/tháng,"CCNA, Cisco, Cisco, Hệ điều hành Linux, Network, Quản Trị Mạng",https://www.vietnamworks.com/chuyen-vien-it-ha-tang--1848713-jv?source=searchResults&searchType=2&placement=1849113&sortBy=latest
Head of IT/ CS Department _ Swinburne HCM Campus (Master Degree or Higher Required),Head of IT/ CS Department _ Swinburne HCM Campus Master Degree or Higher Required,N/A,Swinburne Vietnam (HCMC),Không yêu cầu năm kinh nghiệm,"A35 Bach Dang Street, Ward 2, Tan Binh District, Ho Chi Minh City","$ 1,500-3,000 /tháng","Khoa Học Máy Tính, Giáo Dục Đào Tạo, Giảng Dạy, Công Nghệ Thông Tin, AI",https://www.vietnamworks.com/head-of-it-cs-department-swinburne-hcm-campus-master-degree-or-higher-required-1837803-jv?source=searchResults&searchType=2&placement=1838203&sortBy=latest
"Kỹ Sư Dự Án (Công Nghệ Thông Tin/ Điện, Điện Tử, Viễn Thông....) / Lương Thưởng Hấp Dẫn","Kỹ Sư Dự Án Công Nghệ Thông Tin/ Điện, Điện Tử, Viễn Thông.... / Lương Thưởng Hấp Dẫn",N/A,Công Ty TNHH Thiết Bị Khoa Học Và Công Nghệ Việt Nhật (Vijatech),1 năm kinh nghiệm,"Phòng 1225, tòa nhà CT5, KĐT Sông Đà Mỹ Đình, phường Mỹ Đình 1, quận Nam Từ Liêm, thành phố Hà Nội",Thương lượng,"Công Nghệ Thông Tin, CCNA, SQL, Điện tử viễn thông, TCP/IP",https://www.vietnamworks.com/ky-su-du-an-cong-nghe-thong-tin-dien-dien-tu-vien-thong-luong-thuong-hap-dan--1848188-jv?source=searchResults&searchType=2&placement=1848638&sortBy=latest
"UI-UX Designer (Fresher, English)","UI-UX Designer Fresher, English",Fresher,Hoiio Pte Ltd,Không yêu cầu năm kinh nghiệm,"6th Floor, 40 Phạm Ngọc Thach, District 3, HCMC, Vietnam",Thương lượng,"UI/UX, English, Design, Figma, Sketch, Sketch, Sketch, Sketch, Sketch",https://www.vietnamworks.com/ui-ux-designer-fresher-english-1853262-jv?source=searchResults&searchType=2&placement=1853362&sortBy=latest
Security Analyst,Security Analyst,N/A,Trusting Social,3 năm kinh nghiệm,"Havana Tower, 132, Ham Nghi Str., Ben Thanh Ward, Dist. 1, HCMC",Thương lượng,"SIEM, Securities, Cloud Security, Bash Shell, Python",https://www.vietnamworks.com/security-analyst--1852419-jv?source=searchResults&searchType=2&placement=1852569&sortBy=latest
Rock-Star Senior DevOps Engineer Wanted! [From $1500 | Remote],Rock-Star Senior DevOps Engineer Wanted! From $1500 | Remote,Senior,Buddytrading,3 năm kinh nghiệm,"651 N Broad St, Suite 201, Middletown 19709, New Castle, Delaware, USA","Từ $ 1,500 /tháng","DevOps, Kubernetes, Leadership, Typescript",https://www.vietnamworks.com/rock-star-senior-devops-engineer-wanted-from-dollar1500-or-remote-1855203-jv?source=searchResults&searchType=2&placement=1855203&sortBy=latest
Web Product Owner,Web Product Owner,N/A,Công Ty TNHH Thời Trang Danh Giá,1 năm kinh nghiệm,"Lầu 06, Saigon Trade Center, 37 Tông Đức Thằng, Q. 1, Tp. Hồ Chí Minh",Thương lượng,"Webmaster, Numerical Analysis, Web Administration, Scrum Master, CMS",https://www.vietnamworks.com/web-product-owner--1854267-jv?source=searchResults&searchType=2&placement=1854317&sortBy=latest
Database Administrator,Database Administrator,N/A,VSTV - Truyền Hình Vệ Tinh K+,2 năm kinh nghiệm,"Trụ sở chính: Tòa nhà Handi Resco, 521 Kim Mã, Ba Đình, Hà Nội",Thương lượng,"Information Extraction, Oracle SQL, Python Programming, Report Writing",https://www.vietnamworks.com/database-administrator-1852847-jv?source=searchResults&searchType=2&placement=1852997&sortBy=latest
Hardware Development Engineer,Hardware Development Engineer,N/A,Công Ty TNHH Thiết Kế Hệ Thống Corsair,2 năm kinh nghiệm,"95B-97-99 Tran Quang Dieu, Ward 13, Dist.3, HCMC",Thương lượng,"Hardware Testing, Computer Science, Testing, Manufacturing Engineering, English",https://www.vietnamworks.com/hardware-development-engineer--1760959-jv?source=searchResults&searchType=2&placement=1761059&sortBy=latest
QA Executive,QA Executive,N/A,Pixelz Company Limited,1 năm kinh nghiệm,"15th Floor, Detech II Building, 107 Nguyen Phong Sac, Cau Giay, Hanoi",Thương lượng,"Photoshop, QA, Công Nghệ Thông Tin, Tiếng Anh, Đảm Bảo Chất Lượng",https://www.vietnamworks.com/qa-executive--1852903-jv?source=searchResults&searchType=2&placement=1853053&sortBy=latest
[Fresher] Nhân Viên SRE,Fresher Nhân Viên SRE,Fresher,Công Ty CP Giải Pháp Thanh Toán Việt Nam (VNPAY),1 năm kinh nghiệm,"Tầng 8, số 22, Phố Láng Hạ, Phường Láng Hạ, Quận Đống Đa, Thành phố Hà Nội, Việt Nam",Thương lượng,"Ci/Cd Methodologies, Docker, Kubernetes, Docker, Docker",https://www.vietnamworks.com/fresher-nhan-vien-sre-1846958-jv?source=searchResults&searchType=2&placement=1847508&sortBy=latest
Hot Job! Regional IT Manager,Hot Job! Regional IT Manager,N/A,Navigos Search's Client,10 năm kinh nghiệm,Hanoi,Thương lượng,"Cybersecurity, Infrastructure Management, IT Management, IT Optimization, Network Architecture",https://www.vietnamworks.com/hot-job-regional-it-manager-1850421-jv?source=searchResults&searchType=2&placement=1850721&sortBy=latest
Java Backend Senior Developer,Java Backend Senior Developer,Senior,Capgemini Vietnam,4 năm kinh nghiệm,"Centre Point, 106 Nguyễn Văn Trỗi, Phường 08, Quận Phú Nhuận, Thành phố Hồ Chí Minh",Thương lượng,"AWS, AWS, Backend, Backend, Java System, SQL",https://www.vietnamworks.com/java-backend-senior-developer-1849611-jv?source=searchResults&searchType=2&placement=1849961&sortBy=latest
[ HO ] PWM MIS (Wealth Management),HO PWM MIS Wealth Management,N/A,Shinhan Bank Vietnam,2 năm kinh nghiệm,"Empress Tower, 138-142 Hai Ba Trung Street, Da Kao Ward, District 1, HCMC",Thương lượng,"Analytical Skills, Detail orientation, Detail orientation, Detail orientation, Mathematics, Bachelor Of Economics/Finance, Proficient In Sql, Excel",https://www.vietnamworks.com/ho-pwm-mis-wealth-management-1852617-jv?source=searchResults&searchType=2&placement=1852767&sortBy=latest
Chuyên Viên Lập Trình,Chuyên Viên Lập Trình,N/A,Trường Đại Học Ngoại Ngữ - Tin Học Thành Phố Hồ Chí Minh,1 năm kinh nghiệm,"Số 828 Sư Vạn Hạnh, Phường 13, Quận 10, TP. Hồ Chí Minh",Thương lượng,"PHP, Java, JavaScript, Laravel, Agile Scrum",https://www.vietnamworks.com/chuyen-vien-lap-trinh-1849336-jv?source=searchResults&searchType=2&placement=1849686&sortBy=latest
Technical Product Manager (English),Technical Product Manager English,N/A,Hoiio Pte Ltd,2 năm kinh nghiệm,"6th Floor, 40 Phạm Ngọc Thach, District 3, HCMC, Vietnam","$ 1,000-1,000 /tháng","Product Management, Project Management, Telecommunications, SaaSOps, English",https://www.vietnamworks.com/technical-product-manager-english-1853273-jv?source=searchResults&searchType=2&placement=1853373&sortBy=latest
Chuyên Viên Cao Cấp Vận Hành Ứng Dụng Công Nghệ Thông Tin,Chuyên Viên Cao Cấp Vận Hành Ứng Dụng Công Nghệ Thông Tin,N/A,Công Ty Cổ Phần Chứng Khoán Vndirect,4 năm kinh nghiệm,"HO: Số 1 Nguyễn Thượng Hiền, Hai Bà Trưng, Hà Nội. CN.HCM:  90 Pasteur, P. Bến Nghé, Q1",Thương lượng,"IT System Administration, Công Nghệ Thông Tin, Tài Chính Ngân Hàng, Tiếng Anh",https://www.vietnamworks.com/chuyen-vien-cao-cap-van-hanh-ung-dung-cong-nghe-thong-tin--1854846-jv?source=searchResults&searchType=2&placement=1854846&sortBy=latest
Data Analyst/Strategy Planning Specialist,Data Analyst/Strategy Planning Specialist,N/A,Navigos Search,3 năm kinh nghiệm,HCMC,"$ 1,000-1,500 /tháng","BI Tools, Communication, Data Analysis, Excel Proficiency, Presentation Skills",https://www.vietnamworks.com/data-analyststrategy-planning-specialist-1855322-jv?source=searchResults&searchType=2&placement=1855322&sortBy=latest
Colour Systems Developer,Colour Systems Developer,N/A,Coats Phong Phu,5 năm kinh nghiệm,"8th Floor, Cantavil Premier Building No.1 Song Hanh Hanoi Highway, An Phu Ward, Thu Duc City, HCMC, Vietnam.",Thương lượng,".Net, DevOps, JavaScript, Mobile Application, SharePoint",https://www.vietnamworks.com/colour-systems-developer-1852416-jv?source=searchResults&searchType=2&placement=1852566&sortBy=latest
MS D365 Customer Engagement Functional Consultant,MS D365 Customer Engagement Functional Consultant,N/A,Chi Nhánh Công Ty TNHH KPMG,Không yêu cầu năm kinh nghiệm,"10Floor, 115 Nguyễn Huệ, Ho Chi Minh City, Ho Chi Minh, Vietnam",Thương lượng,"Dynamics 365, CRM, Microsoft Power Platform",https://www.vietnamworks.com/ms-d365-customer-engagement-functional-consultant-1854101-jv?source=searchResults&searchType=2&placement=1854151&sortBy=latest
Kỹ Sư Vận Hành Hệ Thống Bảo Mật,Kỹ Sư Vận Hành Hệ Thống Bảo Mật,N/A,"Công Ty Cổ Phần Công Nghệ Thông Tin, Viễn Thông Và Tự Động Hoá Dầu Khí",3 năm kinh nghiệm,"tầng 14 khu văn phòng, tòa nhà C1 Thành Công, Phố Thành Công, Phường Thành Công, Quận Ba Đình, Hà Nội",220tr-280tr ₫/năm,"Vận Hành Hệ Thống, Bảo Mật Hệ Thống, Hệ Thống Bảo Mật, Firewall, An Toàn Thông Tin",https://www.vietnamworks.com/ky-su-van-hanh-he-thong-bao-mat-1840726-jv?source=searchResults&searchType=2&placement=1840876&sortBy=latest
Chuyên Viên Thông Tin Quản Trị Khối Tài Chính (MIS),Chuyên Viên Thông Tin Quản Trị Khối Tài Chính MIS,N/A,Ngân Hàng TMCP Tiên Phong (Tpbank),1 năm kinh nghiệm,"Tòa nhà TPBank, 57 Lý Thường Kiệt, phường Trần Hưng Đạo",Thương lượng,"Giải Pháp Thông Tin Quản Trị, Lập Trình Ứng Dụng VBA, Microsoft Power BI, SQL",https://www.vietnamworks.com/chuyen-vien-thong-tin-quan-tri-khoi-tai-chinh-mis--1851189-jv?source=searchResults&searchType=2&placement=1851389&sortBy=latest
Product Executive (Vietnam),Product Executive Vietnam,N/A,Tada Technologies,3 năm kinh nghiệm,"33 Trần Não, P.Bình An, Q2, TPHCM",Thương lượng,"Project Analysis, Business Analysis, Quality Assurance, UI/UX, Presentation Skills",https://www.vietnamworks.com/product-executive-vietnam-1850847-jv?source=searchResults&searchType=2&placement=1851097&sortBy=latest
Oracle ERP & Finance Systems Specialist,Oracle ERP & Finance Systems Specialist,N/A,B.Grimm Power Vietnam,5 năm kinh nghiệm,"Phòng 2101, Tầng 21, Tòa nhà Lim Tower, Số 9-11 Đường Tôn Đức Thắng, Phường Bến Nghé, Quận 1, Thành phố Hồ Chí Minh, Việt Nam","$ 1,300-1,750 /tháng","Oracle ERP, PL/SQL, System Integration, Cloud Infrastructure, Microsoft Dynamics ERP",https://www.vietnamworks.com/oracle-erp-and-finance-systems-specialist-1849265-jv?source=searchResults&searchType=2&placement=1849615&sortBy=latest
Chuyên Viên IT (IT Support/help Desk),Chuyên Viên IT IT Support/help Desk,N/A,Công Ty Cổ Phần Tập Đoàn Mutosi,2 năm kinh nghiệm,"Tòa nhà BeaSky, đại lộ Chu Văn An, phường Đại Kim, quận Hoàng Mai, thành phố Hà Nội",$ 600-650 /tháng,"CCNA, Cloud, LINUX, IT System Administration, IT Support",https://www.vietnamworks.com/chuyen-vien-it-it-support-help-desk--1848826-jv?source=searchResults&searchType=2&placement=1849226&sortBy=latest
Senior Full Stack Engineer Cloud Marketplace,Senior Full Stack Engineer Cloud Marketplace,Senior,Bosch Global Software Technologies Company Limited,5 năm kinh nghiệm,"Etown 2, 364 Cong Hoa street, ward 13, Tan Binh district, HCM",Thương lượng,"Java Spring Boot, Restful Apis, Cloud Native Applications, Frontend Frameworks, Sql And No-Sql Databases",https://www.vietnamworks.com/senior-full-stack-engineer-cloud-marketplace-1848997-jv?source=searchResults&searchType=2&placement=1849397&sortBy=latest
Frontend,Frontend,N/A,CLEVERRADS COMPANY LIMITED,5 năm kinh nghiệm,"245 Sukhumvit, Bang Chak district, Phra Khanong District, Bangkok, Thailand.","$ 2,200-2,200 /tháng","CSS, HTML, JavaScript, React, Front End",https://www.vietnamworks.com/frontend-1851710-jv?source=searchResults&searchType=2&placement=1851910&sortBy=latest
Senior Business Project Management Officer,Senior Business Project Management Officer,Senior,Trusting Social,6 năm kinh nghiệm,"Havana Tower, 132, Ham Nghi Str., Ben Thanh Ward, Dist. 1, HCMC",Thương lượng,"Project Management, Business Strategy",https://www.vietnamworks.com/senior-business-project-management-officer-1837978-jv?source=searchResults&searchType=2&placement=1838378&sortBy=latest
Lập Trình Viên .NET,Lập Trình Viên .NET,N/A,Tổng Công Ty Bảo Hiểm BIDV (BIC),1 năm kinh nghiệm,"Tầng 11 – Tòa nhà 263 Cầu Giấy, Đường Cầu Giấy, Phường Dịch Vọng, Quận Cầu Giấy, Thành phố Hà Nội.","$ 800-1,500 /tháng","C#, .NET, SQL, Java, Oracle",https://www.vietnamworks.com/lap-trinh-vien-net--1855610-jv?source=searchResults&searchType=2&placement=1855610&sortBy=latest
IT Support (Trainee),IT Support Trainee,N/A,Hong Leong BANK Vietnam Limited,1 năm kinh nghiệm,"Centec Tower, 72-74 Nguyen Thi Minh Khai, District 3",Từ 7tr ₫/tháng,"Bash Shell Scripting, Communication Skills, Linux, Operating System, PC Hardware",https://www.vietnamworks.com/it-support-trainee-1849737-jv?source=searchResults&searchType=2&placement=1850087&sortBy=latest
IT Support Specialist,IT Support Specialist,N/A,Công Ty TNHH Công Nghệ Và Giải Pháp Phần Mềm Crossian,Không yêu cầu năm kinh nghiệm,"Tầng 5, Pax Sky, 63-65 Ngô Thì Nhậm, Phường Phạm Đình Hổ, Quận Hai Bà Trưng, TP Hà Nội, Việt Nam",Thương lượng,"IT System Administration, IT Helpdesk, IT Support, Infrastructure Supervision, Application Support",https://www.vietnamworks.com/it-support-specialist--1840590-jv?source=searchResults&searchType=2&placement=1840840&sortBy=latest
System Support Team Head,System Support Team Head,N/A,Shinhan Vietnam Finance Company Limited,5 năm kinh nghiệm,17F & 23/F. Saigon Trade Center. 37 Ton Duc Thang. D.1. HCMC. Vietnam,Thương lượng,"System Support, Application Support, PL/SQL, Credit Card System",https://www.vietnamworks.com/system-support-team-head-1836834-jv?source=searchResults&searchType=2&placement=1837084&sortBy=latest
Dev AI (Senior),Dev AI Senior,Senior,Công Ty Cổ Phần Bán Lẻ Kỹ Thuật Số FPT,2 năm kinh nghiệm,"Tầng 6 - Zodiac, 19 Duy Tân, Cầu Giấy, Hà Nội","$ 800-1,500 /tháng","AI, DevOps",https://www.vietnamworks.com/dev-ai-senior-1849160-jv?source=searchResults&searchType=2&placement=1849560&sortBy=latest
Ecommerce Performance Analyst/ Merchandise Planner,Ecommerce Performance Analyst/ Merchandise Planner,N/A,CRC Sports VN,1 năm kinh nghiệm,"163 Phan Đăng Lưu, Phường 3, Quận Phú Nhuận, TP.HCM",Thương lượng,"Data Analysis, Ecommerce Solution, Inventory Management, Merchandise Planning, Promotional Marketing",https://www.vietnamworks.com/ecommerce-performance-analyst-merchandise-planner-1853879-jv?source=searchResults&searchType=2&placement=1853979&sortBy=latest
Nhân Viên Vận Hành Chuỗi Phần Công Nghệ (Đi Làm Sau Tết),Nhân Viên Vận Hành Chuỗi Phần Công Nghệ Đi Làm Sau Tết,N/A,Công ty Cổ phần Trà và Cà Phê Rosier,3 năm kinh nghiệm,"Số 3 Nguyễn Như Uyên, Yên Hoà, Cầu Giấy, Hà Nội",Thương lượng,"Giám Sát Hệ Thống, công nghệ, Vận Hành, Thương mại điện tử (Shopee, TikTok Shop), MyXTeam",https://www.vietnamworks.com/nhan-vien-van-hanh-chuoi-phan-cong-nghe-dji-lam-sau-tet-1854934-jv?source=searchResults&searchType=2&placement=1854934&sortBy=latest
SAP BW/ SAC Senior Analyst - AMS Project,SAP BW/ SAC Senior Analyst - AMS Project,Senior,Deloitte Consulting SEA,1 năm kinh nghiệm,"18th Floor, Times Square Building, 22-36 Nguyen Hue, District 1, HCMC, Vietnam",Thương lượng,"SAP S/4HANA, ERP System, Analytical Thinking, SAP BW/4HANA, SACS",https://www.vietnamworks.com/sap-bw-sac-senior-analyst-ams-project-1848370-jv?source=searchResults&searchType=2&placement=1848820&sortBy=latest
Chuyên Viên Phân Tích Nghiệp Vụ (BA),Chuyên Viên Phân Tích Nghiệp Vụ BA,N/A,Hyundai Thành Công Việt Nam (Hyundai.thanhcong.vn),Không yêu cầu năm kinh nghiệm,"Tầng 12, tòa nhà Thành Công Tower, số 79 Đường Dịch Vọng Hậu, Cầu Giấy, Hà Nội",Thương lượng,"Business Analysis, Công Nghệ Thông Tin, CRM 365, UI/UX, Test Analyst",https://www.vietnamworks.com/chuyen-vien-phan-tich-nghiep-vu-ba--1852227-jv?source=searchResults&searchType=2&placement=1852427&sortBy=latest
Điều Khiển Điện/ Lập Trình PLC (Nhật Bản/HCM),Điều Khiển Điện/ Lập Trình PLC Nhật Bản/HCM,N/A,Công Ty TNHH R Techno Việt Nam,2 năm kinh nghiệm,"107 Đường Tân Cảng, Phường 25, Quận Bình Thạnh, TP.HCM","Từ ¥ 350,000 /tháng","Lập Trình PLC, Thiết Kế Máy Gia Công, Thiết Kế Điện, Tiếng Nhật N3, Kỹ Năng Lập Trình Macro",https://www.vietnamworks.com/djieu-khien-djien-lap-trinh-plc-nhat-banhcm-1838709-jv?source=searchResults&searchType=2&placement=1838959&sortBy=latest
Senior Business Analyst (CMS),Senior Business Analyst CMS,Senior,Techcombank,3 năm kinh nghiệm,"Head Office: 6 Quang Trung Street, Hoan Kiem District, Hanoi","$ 1,000-2,500 /tháng","Information Technology, Business Administration, AEM, Agile, Jira",https://www.vietnamworks.com/senior-business-analyst-cms-1848043-jv?source=searchResults&searchType=2&placement=1848493&sortBy=latest
"SAP MM Senior Consultant (Mandarin Speaking, AMS Project)","SAP MM Senior Consultant Mandarin Speaking, AMS Project",Senior,Deloitte Consulting SEA,5 năm kinh nghiệm,"18th Floor, Times Square Building, 22-36 Nguyen Hue, District 1, HCMC, Vietnam",Thương lượng,"SAP S/4HANA, ERP System, Analytical Thinking, Bilingual In English and Mandarin, Sap Mm",https://www.vietnamworks.com/sap-mm-senior-consultant-mandarin-speaking-ams-project-1848357-jv?source=searchResults&searchType=2&placement=1848807&sortBy=latest
QA Team Leader,QA Team Leader,N/A,WEEDS VINA,5 năm kinh nghiệm,"174 Thái Hà, Trung Liệt, Đống Đa, Hà Nội","600-1,000 ₫/tháng","Test Thủ Công, QA, Analytics Tool, Quality Tools, Giao Tiếp",https://www.vietnamworks.com/qa-team-leader--1847521-jv?source=searchResults&searchType=2&placement=1848021&sortBy=latest
Data Engineer (Data Bricks/ Devops/dbt Language),Data Engineer Data Bricks/ Devops/dbt Language,N/A,Chi Nhánh Công Ty TNHH KPMG,Không yêu cầu năm kinh nghiệm,"10Floor, 115 Nguyễn Huệ, Ho Chi Minh City, Ho Chi Minh, Vietnam",Thương lượng,"Data Architecture, Data analysis, Data Models, Data Mining, Big Data",https://www.vietnamworks.com/data-engineer-data-bricks-devops-dbt-language-1839229-jv?source=searchResults&searchType=2&placement=1839479&sortBy=latest
Product Owner (Project Manager Assistant) - Game Industry,Product Owner Project Manager Assistant - Game Industry,N/A,Navigos Search's Client,3 năm kinh nghiệm,Hanoi,"$ 700-1,000 /tháng","Product Vision, Communication Skills, Problem Solving, Multitasking, Team Motivation",https://www.vietnamworks.com/product-owner-project-manager-assistant-game-industry-1848310-jv?source=searchResults&searchType=2&placement=1848760&sortBy=latest
IT Manager,IT Manager,N/A,New World Fashion Group,1 năm kinh nghiệm,"Road No 353, Anh Dung Ward, Duong Kinh District,  Hai Phong City,  Viet Nam",Thương lượng,"Server Management, LAN, WAN, Security, Networking",https://www.vietnamworks.com/it-manager-81--1852693-jv?source=searchResults&searchType=2&placement=1852843&sortBy=latest
IT System & Network Administrator,IT System & Network Administrator,N/A,Công Ty TNHH R Techno Việt Nam,Không yêu cầu năm kinh nghiệm,"107 Đường Tân Cảng, Phường 25, Quận Bình Thạnh, TP.HCM","$ 600-1,000 /tháng","IT System Administration, IT Hardware, Technical Support, Tiếng Nhật Trung Cấp, Quản Trị Mạng Lan",https://www.vietnamworks.com/it-system-network-administrator-10--1843834-jv?source=searchResults&searchType=2&placement=1843884&sortBy=latest
