Job Title,Role,Level,Company,Year Of Experiences,Location,Salary Range,Required Skills,Source Platform
IT Infrastructure & Architecture Administrator (Quản Trị Viên Kiến Trúc và Hạ Tầng IT),IT Infrastructure & Architecture Administrator Quản Trị Viên Kiến Trúc và Hạ Tầng IT,N/A,Vietnam Australia International School (Vas),5 năm kinh nghiệm,"594 Ba Thang Hai Street, District 10, Ho Chi Minh City",Thương lượng,"IP Routing, CCNA, An Toàn Thông Tin, An Ninh Mạng, Cisco Networking solution",https://www.vietnamworks.com/it-infrastructure-architecture-administrator-quan-tri-vien-kien-truc-va-ha-tang-it-1841780-jv?source=searchResults&searchType=2&placement=1841830&sortBy=date
Senior IT Officer,Senior IT Officer,['Senior'],PLF Law Firm,1 năm kinh nghiệm,"16th Floor , Ruby Tower 81 - 85 Ham Nghi, District 1, Ho Chi Minh City Work Location: Ho Chi Minh",Thương lượng,"CRM, Website Management, Seo, IT Operations, English",https://www.vietnamworks.com/senior-it-officer--1837008-jv?source=searchResults&searchType=2&placement=1837508&sortBy=date
Fintech Innovation Product Manager,Fintech Innovation Product Manager,N/A,Vietpay Corporation,5 năm kinh nghiệm,"Hancorp Plaza Apartment Complex, Hancorp Plaza, 72 Trần Đăng Ninh, Làng Quốc tế Thăng Long, Dịch Vọng, Cầu Giấy, Hà Nội, Vietnam","$ 500-1,500 /tháng","Digital Payment, Product Management, Project Management, UI/UX, Fintech",https://www.vietnamworks.com/fintech-innovation-product-manager-1840485-jv?source=searchResults&searchType=2&placement=1840985&sortBy=date
Chuyên Viên Phát Triển Chương Trình Lập Trình,Chuyên Viên Phát Triển Chương Trình Lập Trình,N/A,RT Holdings,2 năm kinh nghiệm,"240 Trần Bình Trong, Phường 4, Quận 5, TP.HCM",Thương lượng,"Lập Trình, Ngôn Ngữ Lập Trình C, Khoa Học Máy Tính, Kỹ Thuật Máy Tính, Giảng Dạy",https://www.vietnamworks.com/chuyen-vien-phat-trien-chuong-trinh-lap-trinh--1839650-jv?source=searchResults&searchType=2&placement=1840200&sortBy=date
"Front-End Leader (ReactJS, Nextjs)","Front-End Leader ReactJS, Nextjs",N/A,SAPP Academy,1 năm kinh nghiệm,"Số 54 Lê Thanh Nghị, quận Hai Bà Trưng, Hà Nội","$ 1,000-1,300 /tháng","CSS3, HTML5, NextJs, ReactJS, Unit Testing",https://www.vietnamworks.com/front-end-leader-reactjs-nextjs-1840380-jv?source=searchResults&searchType=2&placement=1840580&sortBy=date
Application Engineer (Microsoft Dynamics 365 and Power Platform),Application Engineer Microsoft Dynamics 365 and Power Platform,N/A,De Heus LLC,3 năm kinh nghiệm,"Tầng 12B, tòa nhà Sofic, số 10, đường Mai Chí Thọ, phường Thủ Thiêm, TP. Thủ Đức, TP.HCM",Thương lượng,"Microsoft Dynamics 365, Microsoft Power Platform, Azure, Virtual Machine",https://www.vietnamworks.com/application-engineer-microsoft-dynamics-365-and-power-platform-1843450-jv?source=searchResults&searchType=2&placement=1844000&sortBy=date
Product Owner,Product Owner,N/A,Navigos Search,2 năm kinh nghiệm,Hanoi / HCMC,"$ 1,000-2,000 /tháng","product owner, Agile Development, Analytical Problem Solving, Business Analysis, Communication Skills",https://www.vietnamworks.com/product-owner-138-1843312-jv?source=searchResults&searchType=2&placement=1843862&sortBy=date
AI Video Enhancement Algorithm Engineer (Intern),AI Video Enhancement Algorithm Engineer Intern,N/A,Puwell Cloud Tech Limited,Không yêu cầu năm kinh nghiệm,"Tòa nhà Paragon, số 3 Nguyễn Lương Bằng, P. Tân Phú, Q. 7, TP. Hồ Chí Minh",Thương lượng,"AI/ML, Python Programming, C/C++ Programming, Data Analysis, AI, AI",https://www.vietnamworks.com/ai-video-enhancement-algorithm-engineer-intern-1836403-jv?source=searchResults&searchType=2&placement=1836953&sortBy=date
Staff for IT Planning Department,Staff for IT Planning Department,N/A,"Mizuho Bank, Ltd. - HCMC Branch",Không yêu cầu năm kinh nghiệm,"18/F Sunwah, 115 Nguyen Hue Blvd",Thương lượng,"English, Software Management, Communication, Teamwork, Project Managements",https://www.vietnamworks.com/staff-for-it-planning-department--1826140-jv?source=searchResults&searchType=2&placement=1826690&sortBy=date
Nhân Viên Master Data SAP,Nhân Viên Master Data SAP,N/A,Golden Gate Trade & Service JSC,1 năm kinh nghiệm,"Tầng 6, tòa nhà Toyota Thanh Xuân, 315 Trường  Chinh, Hà Nội",Thương lượng,"SAP, Python, Chuẩn hóa dữ liệu, Quản Lý Dữ Liệu, SAP S/4HANA",https://www.vietnamworks.com/nhan-vien-master-data-sap--1844699-jv?source=searchResults&searchType=2&placement=1845049&sortBy=date
Junior Database Administrator,Junior Database Administrator,['Junior'],Techcombank,3 năm kinh nghiệm,"Head Office: 6 Quang Trung Street, Hoan Kiem District, Hanoi","$ 800-2,500 /tháng","Banking, DBA, Oracle, Csdl, SQLServer",https://www.vietnamworks.com/junior-database-administrator--1838611-jv?source=searchResults&searchType=2&placement=1838961&sortBy=date
HO - Khối Pháp Chế Và Quản Lý Rủi Ro - CVCC Phòng Chống Rửa Tiền,HO - Khối Pháp Chế Và Quản Lý Rủi Ro - CVCC Phòng Chống Rửa Tiền,N/A,Ngân hàng Lộc Phát Việt Nam LPBank,5 năm kinh nghiệm,"LPB Tower, số 210 Đường Trần Quang Khải, French Quarter, Trang Tien, Hoàn Kiếm, Hanoi, Vietnam",Thương lượng,"Giải Quyết Vấn Đề, Luật Pháp Lý, Ngân hàng, SQL, Tài Chính Đầu Tư",https://www.vietnamworks.com/ho-khoi-phap-che-va-quan-ly-rui-ro-cvcc-phong-chong-rua-tien-1831177-jv?source=searchResults&searchType=2&placement=1831627&sortBy=date
Security Specialist upto $2500,Security Specialist upto $2500,N/A,Công Ty TNHH LOTTE Innovate Việt Nam,5 năm kinh nghiệm,"Tầng 7, UOA Tower, số 6 đường Tân Trào, Phường Tân Phú, Quận 7, TP. Hồ Chí Minh, Việt Nam","$ 2,200-2,500 /tháng","Compliance Procedure, Network Security, Security Firewall, Security Infrastructure",https://www.vietnamworks.com/security-specialist-upto-dollar2500-1825528-jv?source=searchResults&searchType=2&placement=1825628&sortBy=date
IT Cyber Security,IT Cyber Security,N/A,Shinhan Vietnam Finance Company Limited,3 năm kinh nghiệm,17F & 23/F. Saigon Trade Center. 37 Ton Duc Thang. D.1. HCMC. Vietnam,Thương lượng,"System Analyst, Application Support, Lending Operations, Core System, Core Banking",https://www.vietnamworks.com/it-cyber-security--1833958-jv?source=searchResults&searchType=2&placement=1834308&sortBy=date
Nhân Viên IT - Công Ty Sản Xuất,Nhân Viên IT - Công Ty Sản Xuất,N/A,Navigos Search,2 năm kinh nghiệm,Hanoi / HCMC,$ 350-400 /tháng,"IT System Administration, Network Support, Hardware Support, IT Security, IT Administration",https://www.vietnamworks.com/nhan-vien-it-cong-ty-san-xuat-1844918-jv?source=searchResults&searchType=2&placement=1845268&sortBy=date
Salesforce Intern With French Speaking,Salesforce Intern With French Speaking,N/A,Capgemini Vietnam,Không yêu cầu năm kinh nghiệm,"Centre Point, 106 Nguyễn Văn Trỗi, Phường 08, Quận Phú Nhuận, Thành phố Hồ Chí Minh",Thương lượng,"Front End, Apex development, French, Agile Methodology, Salesforce Development",https://www.vietnamworks.com/salesforce-intern-with-french-speaking--1843078-jv?source=searchResults&searchType=2&placement=1843128&sortBy=date
CVCC Giải pháp Số,CVCC Giải pháp Số,N/A,Ngân Hàng TMCP Quốc Tế Việt Nam (VIB),5 năm kinh nghiệm,"Sailing Tower, số 111A Pasteur, Phường Bến Nghé, Quận 1, TP. Hồ Chí Minh",Thương lượng,"Dịch Vụ Ngân Hàng Điện Tử, Phân Tích Chiến Lược, Phân Tích Da, Thuyết Trình, Ứng Dụng Công Nghệ Số",https://www.vietnamworks.com/cvcc-giai-phap-so-1841716-jv?source=searchResults&searchType=2&placement=1842216&sortBy=date
Senior Backend Developer (T24/ Core Banking/ Core Card),Senior Backend Developer T24/ Core Banking/ Core Card,['Senior'],Techcombank,2 năm kinh nghiệm,"Head Office: 6 Quang Trung Street, Hoan Kiem District, Hanoi","$ 1,000-2,500 /tháng","Banking, Application Development, Back End Developer, Cloud, Core Banking",https://www.vietnamworks.com/senior-backend-developer-t24-core-banking-core-card-1844497-jv?source=searchResults&searchType=2&placement=1844647&sortBy=date
Senior Data Engineer,Senior Data Engineer,['Senior'],Công Ty Cổ Phần Kite Metric,4 năm kinh nghiệm,"4th Floor, 72/24 Phan Dang Luu st, Ward 5, Phu Nhuan dist, HCMC","$ 1,200-2,200 /tháng","Computer Science, Data Modeling, NodeJS, Python, SQL",https://www.vietnamworks.com/senior-data-engineer-1835321-jv?source=searchResults&searchType=2&placement=1835571&sortBy=date
Cloud Solutions Developer,Cloud Solutions Developer,N/A,Navigos Search's Client,3 năm kinh nghiệm,Hanoi / HCMC,"$ 1,200-2,200 /tháng","Cloud Solution, RESTful Web Service, MS Azure, Troubleshooting, Japanese",https://www.vietnamworks.com/cloud-solutions-developer-1842925-jv?source=searchResults&searchType=2&placement=1843525&sortBy=date
O2O Channel Performance Supervisor (Tiktok/Facebook),O2O Channel Performance Supervisor Tiktok/Facebook,N/A,Abbott,3 năm kinh nghiệm,"02 Ngo Duc Ke, Dist. 1, HCM",Thương lượng,"Chiến Lược O2O, Facebook, Social Commercial, Tiktok Ads, TikTok channel development",https://www.vietnamworks.com/o2o-channel-performance-supervisor-tiktokfacebook-1839928-jv?source=searchResults&searchType=2&placement=1840478&sortBy=date
"Software Engineer (Android, Python) (Quantity: 02)","Software Engineer Android, Python Quantity: 02",N/A,LG Electronics R&D Vietnam,Không yêu cầu năm kinh nghiệm,"Tòa Lotte Mall 272 Võ Chí Công, Phường Phú Thượng, Quận Tây Hồ, Hà Nội","$ 800-2,500 /tháng","Software Engineering, Automotive, Android, Python, Mechatronic",https://www.vietnamworks.com/software-engineer-android-python-quantity-02-1838621-jv?source=searchResults&searchType=2&placement=1838621&sortBy=date
Chuyên Viên Đánh Giá An Toàn Bảo Mật CNTT,Chuyên Viên Đánh Giá An Toàn Bảo Mật CNTT,N/A,Ngân Hàng TMCP Xuất Nhập Khẩu Việt Nam (Eximbank),Không yêu cầu năm kinh nghiệm,"Tầng 8, tòa nhà Vincom center, số 72 Lê Thánh Tôn và 45A Lý Tự Trọng, Quận 1, TP.HCM","$ 1,000-2,000 /tháng","An Toàn Thông Tin Mạng, Bảo Mật Dữ Liệu, Lập Trình, Antihack, An Toàn Thông Tin",https://www.vietnamworks.com/chuyen-vien-danh-gia-an-toan-bao-mat-cntt--1841601-jv?source=searchResults&searchType=2&placement=1841701&sortBy=date
Senior Software Tester – Securities IT,Senior Software Tester – Securities IT,['Senior'],Public Bank Securities Vietnam Company Limited (PBSV),3 năm kinh nghiệm,N/A,Thương lượng,"Communication skills, Computer Science, Finance, Software Testing, Test Planning",https://www.vietnamworks.com/senior-software-tester-securities-it-1838754-jv?source=searchResults&searchType=2&placement=1839404&sortBy=date
IT Business Systems Analyst (IT BSA) - Fluent English - Crm/erp,IT Business Systems Analyst IT BSA - Fluent English - Crm/erp,N/A,MiTek Việt Nam,3 năm kinh nghiệm,"Tòa nhà A5, Lô số A5, khu E-Office, đường Sáng Tạo, KCX Tân Thuận, P. Tân Thuận Đông, Q.7, TP.HCM.",Thương lượng,"Fluent English, CRM & ERP Systems, IT System Administration, Business Analyst, Systems Engineering",https://www.vietnamworks.com/it-business-systems-analyst-it-bsa-fluent-english-crm-erp-1826120-jv?source=searchResults&searchType=2&placement=1826620&sortBy=date
Chuyên Viên Bảo Mật Dữ Liệu - Khối Dữ Liệu - Data Security - Data Division - Khối Dữ Liệu (Ho24.261),Chuyên Viên Bảo Mật Dữ Liệu - Khối Dữ Liệu - Data Security - Data Division - Khối Dữ Liệu Ho24.261,N/A,Ngân Hàng Thương Mại Cổ Phần Quân Đội - MB,3 năm kinh nghiệm,"19th – MB Building,18 Le Van Luong Str., Cau Giay Dist. Hanoi, Vietnam",14tr-30tr ₫/tháng,"Khoa Học Máy Tính, An ninh, Big Data, SQL, IT Security",https://www.vietnamworks.com/chuyen-vien-bao-mat-du-lieu-khoi-du-lieu-data-security-data-division-khoi-du-lieu-ho24-261-1838429-jv?source=searchResults&searchType=2&placement=1838729&sortBy=date
HR Data Analytics Manager,HR Data Analytics Manager,N/A,Prudential Vietnam Assurance,2 năm kinh nghiệm,"8 Đường Hoàng Văn Thái, Quận 7, Thành phố Hồ Chí Minh, Việt Nam",Thương lượng,"Analytical Thinking, Data Analysis, Excellent communication, HRIS System, Stakeholder Management",https://www.vietnamworks.com/hr-data-analytics-manager-1838445-jv?source=searchResults&searchType=2&placement=1838445&sortBy=date
2D Game Artist,2D Game Artist,N/A,Athena Studio,5 năm kinh nghiệm,"40A Lam Sơn, Phường 2, Quận Tân Bình, TPHCM",20tr-30tr ₫/tháng,"VFX, Game 2D, Photoshop, Spine 2D, UI - UX",https://www.vietnamworks.com/2d-game-artist-1840921-jv?source=searchResults&searchType=2&placement=1841021&sortBy=date
Fullstack/Backend Software Engineer (Java Spring/React) (m/f/d),Fullstack/Backend Software Engineer Java Spring/React m/f/d,N/A,Proliance GmbH,3 năm kinh nghiệm,N/A,"$ 1,000-2,500 /tháng","Java Spring Boot, React, Software Development",https://www.vietnamworks.com/fullstackbackend-software-engineer-java-springreact-mfd-1842513-jv?source=searchResults&searchType=2&placement=1843113&sortBy=date
Nhân Viên Dự Án,Nhân Viên Dự Án,N/A,Viettel Hà Nội - Chi Nhánh Tập Đoàn Công Nghệ Viễn Thông Quân Đội (Hni),1 năm kinh nghiệm,"Tầng 3, Tháp A, Tòa nhà The Light, Đường Tố Hữu, Phường Trung Văn, Quận Nam Từ Liêm, Thành phố Hà Nội, Việt Nam",$ 625-750 /tháng,"Hạ Tầng Mạng, Tư Vấn Thiết Kế, Điện Tử Viễn Thông, Công Nghệ Thông Tin, Quản Lý Dự Án",https://www.vietnamworks.com/nhan-vien-du-an--1840903-jv?source=searchResults&searchType=2&placement=1841053&sortBy=date
UI / UX Designer Expert ( Banking / Finance ),UI / UX Designer Expert Banking / Finance,N/A,GTV VIETNAM,4 năm kinh nghiệm,.,Thương lượng,"Problem-solving, Software Prototyping, UI/UX, User-Centered Design, Visual Communication",https://www.vietnamworks.com/ui-ux-designer-expert-banking-finance-1829926-jv?source=searchResults&searchType=2&placement=1830326&sortBy=date
Lập Trình Viên Phần Mềm (Software Developer) - HỒ CHÍ MINH,Lập Trình Viên Phần Mềm Software Developer - HỒ CHÍ MINH,N/A,"Công Ty TNHH Thiết Bị Minh Tâm (Mitalab Co., Ltd)",1 năm kinh nghiệm,"Tòa nhà Mitalab 76 Giảng Võ, Đống Đa, Hà Nội.",Thương lượng,"C#, .NET Framework, .NET Framework, JavaScript, ReactJs, SQL Server, SQL Server",https://www.vietnamworks.com/lap-trinh-vien-phan-mem-software-developer-ho-chi-minh-1836931-jv?source=searchResults&searchType=2&placement=1837081&sortBy=date
"Back-end Developer (Golang, PostgreSQL)","Back-end Developer Golang, PostgreSQL",N/A,Công Ty TNHH 1Long,3 năm kinh nghiệm,"62 Trần Quang Khải, Phường Tân Định, Quận 1, TP Hồ Chí Minh","$ 1,200-1,500 /tháng","Fintech, Startup Development",https://www.vietnamworks.com/back-end-developer-golang-postgresql-1843674-jv?source=searchResults&searchType=2&placement=1844174&sortBy=date
Quản Lý Chất Lượng - Công Ty Gỗ (mức lương hấp dẫn),Quản Lý Chất Lượng - Công Ty Gỗ mức lương hấp dẫn,N/A,Navigos Search's Client,5 năm kinh nghiệm,Hanoi,Thương lượng,"QA, QC, Tiếng Anh, Tiếng Nhật, Quality Control",https://www.vietnamworks.com/quan-ly-chat-luong-cong-ty-go-muc-luong-hap-dan-1839006-jv?source=searchResults&searchType=2&placement=1839706&sortBy=date
"Project management (Digitalization), SPX Express","Project management Digitalization , SPX Express",N/A,CÔNG TY TNHH SPX EXPRESS,2 năm kinh nghiệm,N/A,Thương lượng,"business analyst, Communication Skills, Data Analysis, Problem Solving, Project Management",https://www.vietnamworks.com/project-management-digitalization-spx-express-1844640-jv?source=searchResults&searchType=2&placement=1844990&sortBy=date
Chuyên Viên Editor - Mức Lương Hấp Dẫn 13-18 Triệu,Chuyên Viên Editor - Mức Lương Hấp Dẫn 13-18 Triệu,N/A,Công Ty TNHH In và dịch vụ thương mại Quang Trung,2 năm kinh nghiệm,"Trụ sở: số 47, BT2 Khu đô thị Pháp Vân, Phường Hoàng Liệt, Quận Hoàng Mai, Hà Nội",13tr-18tr ₫/tháng,"Chủ Động, Dựng Video Ngắn Trên Tiktok, Kỹ năng làm việc nhóm",https://www.vietnamworks.com/chuyen-vien-editor-muc-luong-hap-dan-13-18-trieu-1832002-jv?source=searchResults&searchType=2&placement=1832052&sortBy=date
Information Security Management Staff (Accept Fresher),Information Security Management Staff Accept Fresher,['Fresher'],HYUNDAI Kefico,Không yêu cầu năm kinh nghiệm,"Lô XN 01 - Khu công nghiệp Đại An - P Tứ Minh, TP Hải Dương, T Hải Dương",Thương lượng,"ISO 27001, Data Security, Ceh-V5, Audit",https://www.vietnamworks.com/information-security-management-staff-accept-fresher--1844206-jv?source=searchResults&searchType=2&placement=1844356&sortBy=date
IT Senior Infrastructure/ Chuyên Viên Hạ Tầng IT Cao Cấp,IT Senior Infrastructure/ Chuyên Viên Hạ Tầng IT Cao Cấp,['Senior'],Công Ty Cổ Phần Chứng Khoán Guotai Junan (Việt Nam),5 năm kinh nghiệm,"P9-10, tầng 1, Charm Vit Tower, số 117 Trần Duy Hưng, phường Trung Hòa, quận Cầu Giấy, thành phố Hà Nội.",Thương lượng,"IT System Administration, IT Operations, Công nghệ thông tin, Computer Science, IT System Development",https://www.vietnamworks.com/it-senior-infrastructure-chuyen-vien-ha-tang-it-cao-cap--1835357-jv?source=searchResults&searchType=2&placement=1835607&sortBy=date
Scrum Master (SM) Upto 4000Usd,Scrum Master SM Upto 4000Usd,N/A,Công Ty Cổ Phần Bán Lẻ Kỹ Thuật Số FPT,3 năm kinh nghiệm,"Tầng 6 - Zodiac, 19 Duy Tân, Cầu Giấy, Hà Nội","$ 3,000-4,000 /tháng","Scrum Master, Technical, Software Development, Quản Lý Dự Án Công Nghệ, Phân Tích Thuật Toán",https://www.vietnamworks.com/scrum-master-sm-upto-4000usd--1838646-jv?source=searchResults&searchType=2&placement=1838646&sortBy=date
Internship Tester (French),Internship Tester French,N/A,Capgemini Vietnam,Không yêu cầu năm kinh nghiệm,"Centre Point, 106 Nguyễn Văn Trỗi, Phường 08, Quận Phú Nhuận, Thành phố Hồ Chí Minh",Thương lượng,"Java, Python, C#, Test, French",https://www.vietnamworks.com/internship-tester-french--1840773-jv?source=searchResults&searchType=2&placement=1840873&sortBy=date
Customer Service Specialist,Customer Service Specialist,N/A,VinHMS,1 năm kinh nghiệm,"Số 16-18  Đường số 65, Phường Thảo Điền, Thành phố Thủ Đức, thành phố Hồ Chí Minh",Thương lượng,"Communication And Problem-Solving Skills, CRM, Customer Service, Hospitality Solution, Software Analysis",https://www.vietnamworks.com/customer-service-specialist-1842910-jv?source=searchResults&searchType=2&placement=1843510&sortBy=date
Sale (Mảng Quà Tặng),Sale Mảng Quà Tặng,N/A,Công Ty Cổ Phần Truyền Thông Và Công Nghệ Khải Minh,3 năm kinh nghiệm,"Tòa The One, Số 2 Chương Dương Độ, Hoàn Kiếm, Hà Nội",Từ 700 ₫/tháng,"Tìm Kiếm Khách Hàng, Khai Thác Khách Hàng, B2B Sales, Telesales, Thu Hồi Công Nợ",https://www.vietnamworks.com/sale-mang-qua-tang--1840289-jv?source=searchResults&searchType=2&placement=1840489&sortBy=date
Service Delivery Manager,Service Delivery Manager,N/A,Pernod Ricard Vietnam,5 năm kinh nghiệm,"Head Office: 26th Floor, Vietcombank Tower, No.5 Cong Truong Me Linh, Ben Nghe Ward, District 1, Ho Chi Minh City",Thương lượng,"Digital Strategy Planning, It Governance & Compliance, Technical Support, Technical Authority, Project Management",https://www.vietnamworks.com/service-delivery-manager-1836815-jv?source=searchResults&searchType=2&placement=1837015&sortBy=date
Business Analyst Officer (Temporary 10 Months Contract) / Chuyên Viên Phân Tích Nghiệp Vụ (HĐLĐ 10 Tháng),Business Analyst Officer Temporary 10 Months Contract / Chuyên Viên Phân Tích Nghiệp Vụ HĐLĐ 10 Tháng,N/A,Hanwha Life Vietnam,5 năm kinh nghiệm,"Lầu 6, Tòa nhà Doji, 81-85 Hàm Nghi, Quận 1, Tp. HCM",Thương lượng,"Analytical Thinking, Business Analysis, Effective Communication, Problem Solving, Project Management",https://www.vietnamworks.com/business-analyst-officer-temporary-10-months-contract-chuyen-vien-phan-tich-nghiep-vu-hdjldj-10-thang-1839707-jv?source=searchResults&searchType=2&placement=1840257&sortBy=date
Senior Consultant | Technology Transformation (Financial Services) In HCMC,Senior Consultant | Technology Transformation Financial Services In HCMC,['Senior'],Ernst & Young Vietnam Limited (EY Vietnam),2 năm kinh nghiệm,"Bitexco Financial Tower, 28th Floor, 2 Hai Trieu street, District 1, Ho Chi Minh City & 8th Floor, Corner Stone Building, 16 Phan Chu Trinh, Hoan Kiem, Hanoi",Thương lượng,"Core Banking, Project Managing, Payment, CRM, Fintech",https://www.vietnamworks.com/senior-consultant-technology-transformation-financial-services-in-hcmc-1821799-jv?source=searchResults&searchType=2&placement=1822349&sortBy=date
Senior UX/UI Designer,Senior UX/UI Designer,['Senior'],Capgemini Vietnam,5 năm kinh nghiệm,"Centre Point, 106 Nguyễn Văn Trỗi, Phường 08, Quận Phú Nhuận, Thành phố Hồ Chí Minh",Thương lượng,"Adobe Creative Suite, English, Thiết Kế UI-UX, Figma, HTML/CSS",https://www.vietnamworks.com/senior-ux-ui-designer--1843365-jv?source=searchResults&searchType=2&placement=1843365&sortBy=date
"Nhân Viên IT (Nam, Cao Đẳng Công Nghệ Thông Tin)","Nhân Viên IT Nam, Cao Đẳng Công Nghệ Thông Tin",N/A,Công Ty TNHH Sumidenso Việt Nam,Không yêu cầu năm kinh nghiệm,"KHU CÔNG NGHIỆP ĐẠI AN, Km 51, QUỐC LỘ 5 TP HẢI DƯƠNG, TỈNH HẢI DƯƠNG",Thương lượng,"IT System Administration, Network, Hệ Thống Mạng",https://www.vietnamworks.com/nhan-vien-it-nam-cao-dang-cong-nghe-thong-tin-1838159-jv?source=searchResults&searchType=2&placement=1838209&sortBy=date
Trưởng Nhóm Quản Lý Hệ Thống và Hạ Tầng CNTT,Trưởng Nhóm Quản Lý Hệ Thống và Hạ Tầng CNTT,N/A,Bệnh Viện Mắt Quốc Tế Việt - Nga,5 năm kinh nghiệm,"Tầng 7 tòa nhà Hancorp 72 Trần Đăng Ninh, Quận Cầu Giấy , Hà Nội , Việt Nam",Thương lượng,"Firewall, Bảo Mật Dữ Liệu, Windows Server, Linux, Infrastructure Management",https://www.vietnamworks.com/truong-nhom-quan-ly-he-thong-va-ha-tang-cntt-1835234-jv?source=searchResults&searchType=2&placement=1835484&sortBy=date
Senior Technical Manager (Outsystems Workflow Platform Development),Senior Technical Manager Outsystems Workflow Platform Development,['Senior'],Bosch Global Software Technologies Company Limited,7 năm kinh nghiệm,"Etown 2, 364 Cong Hoa street, ward 13, Tan Binh district, HCM",Thương lượng,"Agile Methodologies, Leadership Skills, Project Management, OutSystems development, Technical proficiency in low-code platforms",https://www.vietnamworks.com/senior-technical-manager-outsystems-workflow-platform-development-1836951-jv?source=searchResults&searchType=2&placement=1837401&sortBy=date
Senior Java Backend Developer,Senior Java Backend Developer,['Senior'],Công Ty Cổ Phần Bảo Hiểm Opes,Không yêu cầu năm kinh nghiệm,"Tầng 6, tòa nhà số 5 Điện Biên Phủ, Phường Điện Biên, Quận Ba Đình, Thành phố Hà Nội",Thương lượng,"Spring, Microservices, Java, Insurtech",https://www.vietnamworks.com/senior-java-backend-developer--1841146-jv?source=searchResults&searchType=2&placement=1841296&sortBy=date
Lập Trình Viên Full Stack,Lập Trình Viên Full Stack,N/A,Travel Sense Asia,1 năm kinh nghiệm,"156 Kim Mã, Ba Đình, Hà Nội",Thương lượng,"Khoa Học Máy Tính, Full Stack Development, PHP/MySQL, JavaScript, ReactJS",https://www.vietnamworks.com/lap-trinh-vien-full-stack--1823504-jv?source=searchResults&searchType=2&placement=1823654&sortBy=date
Service Desk Agent Asia,Service Desk Agent Asia,N/A,N/A,2 năm kinh nghiệm,N/A,Thương lượng,"Citrix System, IT Helpdesk, Chinese fluency, English Language Proficiency, German",https://www.vietnamworks.com/service-desk-agent-asia-1841604-jv?source=searchResults&searchType=2&placement=1841804&sortBy=date
R&D Engineer (Software),R&D Engineer Software,N/A,Panasonic Appliances Vietnam,Không yêu cầu năm kinh nghiệm,"Plot B6, Thang Long Industrial Park, Vong La, Dong Anh, Ha Noi",Thương lượng,"C Programming Language, Software Development, Embedded Software, Electronic, Computer Science",https://www.vietnamworks.com/r-d-engineer-software-1839397-jv?source=searchResults&searchType=2&placement=1839597&sortBy=date
Tester,Tester,N/A,Golden Gate Trade & Service JSC,2 năm kinh nghiệm,"Tầng 6, tòa nhà Toyota Thanh Xuân, 315 Trường  Chinh, Hà Nội",Thương lượng,"Manual Testing, Mobile Application Testing, Bugs Testing, Software Testing, Agile Scrum",https://www.vietnamworks.com/tester-105-1-1-1--1840584-jv?source=searchResults&searchType=2&placement=1841084&sortBy=date
"Senior Manager, Digital Bancassurance","Senior Manager, Digital Bancassurance",['Senior'],FWD Vietnam Life Insurance Company Limited,Không yêu cầu năm kinh nghiệm,"11th Floor, Diamond Plaza Building, 34 Le Duan Street, Ben Nghe Ward, District 1, Ho Chi Minh City, Vietnam",Thương lượng,"Ecommerce Background, Digitalization, Digital Platform, Sales Planning, User Experience",https://www.vietnamworks.com/senior-manager-digital-bancassurance--1841807-jv?source=searchResults&searchType=2&placement=1842457&sortBy=date
