Job Title,Role,Level,Company,Year Of Experiences,Location,Salary Range,Required Skills,Source Platform
"Integration Staff (Implementation, Business Analyst, Data Analyst)","Integration Staff Implementation, Business Analyst, Data Analyst",N/A,"Truecommerce Vietnam Company, Limited",1 năm kinh nghiệm,"Helios Building, Quang Trung Software Complex, District 12",Thương lượng,"business analyst, Customer Service, ERP, Multitasking, Service Implementation",https://www.vietnamworks.com/integration-staff-implementation-business-analyst-data-analyst-1842742-jv?source=searchResults&searchType=2&placement=1842842&sortBy=date
[VN-83] Thiết Kế Và Phát Triển Hệ Thống,VN-83 Thiết Kế Và Phát Triển Hệ Thống,N/A,Công Ty TNHH R Techno Việt Nam,1 năm kinh nghiệm,"107 Đường Tân Cảng, Phường 25, Quận Bình Thạnh, TP.HCM",Từ 46tr ₫/tháng,"C++, Phát Triển Ứng Dụng, Python, VB.NET, Xử Lý Ảnh",https://www.vietnamworks.com/vn-83-thiet-ke-va-phat-trien-he-thong-1838705-jv?source=searchResults&searchType=2&placement=1839355&sortBy=date
Senior Microsoft Dynamics 365 F&O Technical Consultant,Senior Microsoft Dynamics 365 F&O Technical Consultant,['Senior'],CÔNG TY TNHH BMBSOFT VIỆT NAM,5 năm kinh nghiệm,N/A,"Tới $ 3,500 /tháng","AX Development, ERP Dynamic 365, Microsoft Power Platform, X++",https://www.vietnamworks.com/senior-microsoft-dynamics-365-fando-technical-consultant-1838372-jv?source=searchResults&searchType=2&placement=1838672&sortBy=date
Software Engineer,Software Engineer,N/A,N/A,5 năm kinh nghiệm,N/A,"$ 1,000-1,500 /tháng","C/C++ Programming, Embedded Software, Communication Protocols, Firmware, Problem Analysis",https://www.vietnamworks.com/software-engineer-727-1845103-jv?source=searchResults&searchType=2&placement=1845403&sortBy=date
Solution Engineer (Ict/it Solutions),Solution Engineer Ict/it Solutions,N/A,Công Ty TNHH Công Nghệ Hồng Cơ,2 năm kinh nghiệm,"124 Huỳnh Tấn Phát, Phường Tân Thuận Tây, Quận 7, Thành phố Hồ Chí Minh, Việt Nam","$ 400-1,200 /tháng","Hạ Tầng Công Nghệ, Hạ Tầng Hệ Thống, Kỹ Thuật Máy Tính, ICT, IT Infrastructure Management",https://www.vietnamworks.com/solution-engineer-ict-it-solutions-1837908-jv?source=searchResults&searchType=2&placement=1838208&sortBy=date
Data Analyst,Data Analyst,N/A,GSM,Không yêu cầu năm kinh nghiệm,"Symphony Office, đường Chu Huy Mân, Long Biên, Hà Nội","$ 1,000-2,000 /tháng","SQL, Data Analysis, Business Intelligence, Business Analysis, Power BI",https://www.vietnamworks.com/data-analyst--1835915-jv?source=searchResults&searchType=2&placement=1836165&sortBy=date
Trưởng Nhóm Quản Lý Phần Mềm Ứng Dụng & Cơ Sở Dữ Liệu,Trưởng Nhóm Quản Lý Phần Mềm Ứng Dụng & Cơ Sở Dữ Liệu,N/A,Bệnh Viện Mắt Quốc Tế Việt - Nga,5 năm kinh nghiệm,"Tầng 7 tòa nhà Hancorp 72 Trần Đăng Ninh, Quận Cầu Giấy , Hà Nội , Việt Nam",Thương lượng,"Bảo Mật Dữ Liệu, Cơ Sở Dữ Liệu, PostgreSQL, HIS, Database SQL Server",https://www.vietnamworks.com/truong-nhom-quan-ly-phan-mem-ung-dung-co-so-du-lieu-1840176-jv?source=searchResults&searchType=2&placement=1840376&sortBy=date
Fresh Speed Up 2025 | Staff - IT,Fresh Speed Up 2025 | Staff - IT,N/A,B.Braun Vietnam Company Ltd.,Không yêu cầu năm kinh nghiệm,"Thanh Oai Industrial Complex, Thanh Oai, Ha Noi",Thương lượng,"Công nghệ thông tin, Khoa Học Máy Tính, Tiếng Anh thành thạo",https://www.vietnamworks.com/fresh-speed-up-2025-staff-it-1839462-jv?source=searchResults&searchType=2&placement=1839662&sortBy=date
Tư Vấn Giải Pháp Mạng (Network Presale),Tư Vấn Giải Pháp Mạng Network Presale,N/A,Công Ty Cổ Phần Tập Đoàn HiPT,1 năm kinh nghiệm,"Tòa nhà HiPT, 152 Thụy Khuê, Tây Hồ, Hà Nội",Thương lượng,"System Integrators, Consultant Service, Firewall, Cisco Firewall Security, Cloud Storage",https://www.vietnamworks.com/tu-van-giai-phap-mang-network-presale--1843420-jv?source=searchResults&searchType=2&placement=1843970&sortBy=date
UI UX Designer,UI UX Designer,N/A,Doo Group,1 năm kinh nghiệm,"42 Ngô Quang Huy, Thao Dien, Quận 2, Ho Chi Minh City, Vietnam","$ 900-1,000 /tháng","UX Design, UI Design, Adobe Illustrator, Adobe Photoshop, Figma",https://www.vietnamworks.com/ui-ux-designer--1841914-jv?source=searchResults&searchType=2&placement=1842564&sortBy=date
Java Software Developer - Hybrid Working,Java Software Developer - Hybrid Working,N/A,Công Ty Tài Chính TNHH Ngân Hàng TMCP Sài Gòn - Hà Nội (Shbfinance),3 năm kinh nghiệm,"Trụ sở chính: Tầng 6, Tòa nhà Gelex, 52 phố Lê Đại Hành, phường Lê Đại Hành, Q. Hai Bà Trưng, Hà Nội",Thương lượng,"Java, Spring Boot, Microservices Architecture, Oracle, Postgres",https://www.vietnamworks.com/java-software-developer-hybrid-working-1838762-jv?source=searchResults&searchType=2&placement=1839312&sortBy=date
Cybersecurity Engineer,Cybersecurity Engineer,N/A,"First Trust ACPA Vietnam CO., LTD",1 năm kinh nghiệm,"Level 8, Hoa Binh International Towers  106 Hoang Quoc Viet street, Cau Giay District, Hanoi, Vietnam",Thương lượng,"Communication Skills, Network Security, Penetration Testing",https://www.vietnamworks.com/cybersecurity-engineer--1841538-jv?source=searchResults&searchType=2&placement=1841988&sortBy=date
Kỹ Sư IT ERP/ EA Smfg,Kỹ Sư IT ERP/ EA Smfg,N/A,Công Ty TNHH Liteon Việt Nam,Không yêu cầu năm kinh nghiệm,"Số 149, đường 10, Khu công nghiệp VSIP Hải Phòng","Tới $ 1,000 /tháng","C#, ERP, SQL Server, Oracle, IT Phần Mềm",https://www.vietnamworks.com/ky-su-it-erp-ea-smfg--1827329-jv?source=searchResults&searchType=2&placement=1827629&sortBy=date
Fresher IT Developer,Fresher IT Developer,['Fresher'],Navigos Search's Client,Không yêu cầu năm kinh nghiệm,Hanoi,$ 350-450 /tháng,"SQL, English",https://www.vietnamworks.com/fresher-it-developer-1844376-jv?source=searchResults&searchType=2&placement=1844776&sortBy=date
ERP Project Leader (Experienced in Garment Industry),ERP Project Leader Experienced in Garment Industry,N/A,Chi Nhánh Hà Nội - Công Ty TNHH Kiara Garments Việt Nam,8 năm kinh nghiệm,"Tầng 9, tòa nhà IDMC Mỹ Đình, số 15 Phạm Hùng, phường Mỹ Đình 2, quận Nam Từ Liêm, TP Hà Nội",35tr-85tr ₫/tháng,"ERP Management, Gap Analysis, Project Planning, Restructuring, Software Implementation",https://www.vietnamworks.com/erp-project-leader-experienced-in-garment-industry-1844721-jv?source=searchResults&searchType=2&placement=1844821&sortBy=date
Phó Phòng Hỗ Trợ Người Dùng/ IT Helpdesk Deputy Manager,Phó Phòng Hỗ Trợ Người Dùng/ IT Helpdesk Deputy Manager,N/A,Công Ty TNHH TM DV Tân Hiệp Phát,5 năm kinh nghiệm,"219 Đại lộ Bình Dương, Vĩnh Phú, Thuận An, Bình Dương",Thương lượng,"Information Technology, IT Helpdesk, Helpdesk, English, IT",https://www.vietnamworks.com/pho-phong-ho-tro-nguoi-dung-it-helpdesk-deputy-manager-1842515-jv?source=searchResults&searchType=2&placement=1843115&sortBy=date
Quality Control Supervisor,Quality Control Supervisor,N/A,Công Ty TNHH Premo Việt Nam,2 năm kinh nghiệm,"KCN Điện Nam - Điện Ngọc, Quảng Nam (Giáp ranh Đà Nẵng)",Thương lượng,"IATF 16949:2016, ISO 9001, Quality Control, Sap, Team Management",https://www.vietnamworks.com/quality-control-supervisor-1836231-jv?source=searchResults&searchType=2&placement=1836781&sortBy=date
Product Manager - ERP Omnichannel,Product Manager - ERP Omnichannel,N/A,Abbott,Không yêu cầu năm kinh nghiệm,"02 Ngo Duc Ke, Dist. 1, HCM",Thương lượng,"ERP, ERP System  Integration",https://www.vietnamworks.com/product-manager-erp-omnichannel-1833777-jv?source=searchResults&searchType=2&placement=1834277&sortBy=date
Wastewater Process & Controls Engineer,Wastewater Process & Controls Engineer,N/A,LR-TEK,3 năm kinh nghiệm,21 rue de Lyon,Thương lượng,"Artificial Intelligence, C Programming Language, Control System, Machine Learning, Aeration System Design",https://www.vietnamworks.com/wastewater-process-and-controls-engineer-1839935-jv?source=searchResults&searchType=2&placement=1840435&sortBy=date
RF Engineer,RF Engineer,N/A,Công Ty TNHH Công Nghệ Huawei Việt Nam,2 năm kinh nghiệm,"33F, Keangnam Landmark, Pham Hung, Nam Tu Liem, Hanoi",Thương lượng,"Database Technology, Effective Communication, Radio Design, Software System Architecture, Telecommunications",https://www.vietnamworks.com/rf-engineer-1840338-jv?source=searchResults&searchType=2&placement=1840338&sortBy=date
Senior Backend Developer,Senior Backend Developer,['Senior'],Công Ty TNHH VHG DATA,4 năm kinh nghiệm,"756A Âu Cơ, Ward 14, Tan Binh District, Ho Chi Minh City, Vietnam","$ 1,000-2,000 /tháng","NodeJS, PHP, Python, MongoDB",https://www.vietnamworks.com/senior-backend-developer--1806676-jv?source=searchResults&searchType=2&placement=1807276&sortBy=date
IT Helpdesk,IT Helpdesk,N/A,Grant Thornton (Vietnam) Limited,Không yêu cầu năm kinh nghiệm,"18th Floor, Hoa Binh International Office Building 106 Hoang Quoc Viet Street, Cau Giay District  Hanoi, Vietnam",Thương lượng,"Technical Support, Helpdesk, English, Equipment Installation, Linux",https://www.vietnamworks.com/it-helpdesk--1844409-jv?source=searchResults&searchType=2&placement=1844809&sortBy=date
Database Administrator,Database Administrator,N/A,Discova (Formerly Known As Buffalo Tours),2 năm kinh nghiệm,"33 Truc Bach, Ba Dinh, Ha Noi",30tr-33tr ₫/tháng,"Database Design, Microsoft Dynamics 365, Azure SQL, English, Microsoft SQL Server",https://www.vietnamworks.com/database-administrator-1835941-jv?source=searchResults&searchType=2&placement=1836491&sortBy=date
System Engineer,System Engineer,N/A,Skylab Innogram Vietnam LLC,2 năm kinh nghiệm,"District 3, HCMC",Thương lượng,"Linux System Administration, Infrastructure-As-Code, Bash, Python",https://www.vietnamworks.com/system-engineer-1838942-jv?source=searchResults&searchType=2&placement=1839142&sortBy=date
Quality Assurance Analyst,Quality Assurance Analyst,N/A,Công Ty TNHH Công Nghệ TikTok Việt Nam,1 năm kinh nghiệm,"LIM Tower 3 - 29A Nguyễn Đình Chiểu, phường Đa Kao, Quận 1, TP.HCM",Thương lượng,"Attention To Detail, English, Image Moderation, Interpersonal Skills, Quality Assurance",https://www.vietnamworks.com/quality-assurance-analyst-1844110-jv?source=searchResults&searchType=2&placement=1844260&sortBy=date
IT Network Engineer (Accept Fresher),IT Network Engineer Accept Fresher,['Fresher'],HYUNDAI Kefico,Không yêu cầu năm kinh nghiệm,"Lô XN 01 - Khu công nghiệp Đại An - P Tứ Minh, TP Hải Dương, T Hải Dương",Thương lượng,"English, Công Nghệ Thông Tin",https://www.vietnamworks.com/it-network-engineer-accept-fresher--1831657-jv?source=searchResults&searchType=2&placement=1831757&sortBy=date
Odoo Developer,Odoo Developer,N/A,ILA Vietnam,2 năm kinh nghiệm,"The Crest Residence, 15 Tran Bach Dang, Thu Thiem ward, Thu Duc city",Thương lượng,"Odoo ERP, XML, CSS, JavaScript, Python",https://www.vietnamworks.com/odoo-developer--1828390-jv?source=searchResults&searchType=2&placement=1828840&sortBy=date
Data Analyst - Long An,Data Analyst - Long An,N/A,Công Ty TNHH Starry Vietnam,5 năm kinh nghiệm,"Lô B2, Đường Dọc 3, KCN Phú An Thạnh, Xã An Thạnh, Huyện Bến Lức, Tỉnh Long An, Việt Nam","$ 1,000-1,200 /tháng","Attention To Detail, Data Analysis, Excel, Power BI, Kpi Development",https://www.vietnamworks.com/data-analyst-long-an-1838366-jv?source=searchResults&searchType=2&placement=1838666&sortBy=date
Digital Platform Specialist,Digital Platform Specialist,N/A,Cathay United Bank,3 năm kinh nghiệm,"Taipei, Taiwan",Thương lượng,"Agile Methodology & Scrum, Digital Banking, Digital platform operations, Fintech, User Experience Development",https://www.vietnamworks.com/digital-platform-specialist-1839469-jv?source=searchResults&searchType=2&placement=1839919&sortBy=date
Kỹ Sư Chất Lượng (Thành thạo Tiếng Trung),Kỹ Sư Chất Lượng Thành thạo Tiếng Trung,N/A,Navigos Search's Client,Không yêu cầu năm kinh nghiệm,Hung Yen,"$ 1,500-1,600 /tháng","Tiếng Trung, Chinese, Quản lý chất lượng, QC, RBA",https://www.vietnamworks.com/ky-su-chat-luong-thanh-thao-tieng-trung--1841202-jv?source=searchResults&searchType=2&placement=1841852&sortBy=date
"Senior Associate, Product Management, SPX Express","Senior Associate, Product Management, SPX Express",['Senior'],CÔNG TY TNHH SPX EXPRESS,3 năm kinh nghiệm,N/A,Thương lượng,"Data Analysis, Product Application, Product Delivery, Product Discovery, Technical Thinking",https://www.vietnamworks.com/senior-associate-product-management-spx-express-1835727-jv?source=searchResults&searchType=2&placement=1836327&sortBy=date
Senior Software Engineer & Development,Senior Software Engineer & Development,['Senior'],BIDV Metlife Life Insurance LLC,4 năm kinh nghiệm,"10th Floor, Tower A, Vincom City Towers,  191 Ba Trieu Street, Le Dai Hanh Ward, Hai Ba Trung District, Hanoi, Vietnam",Thương lượng,"Software Development, Software Design, Spring, Apache, ReactJS",https://www.vietnamworks.com/senior-software-engineer-development--1840829-jv?source=searchResults&searchType=2&placement=1840979&sortBy=date
Chuyên Viên Vận Hành Open Banking & Dịch Vụ Kết Nối - Khối CNTT,Chuyên Viên Vận Hành Open Banking & Dịch Vụ Kết Nối - Khối CNTT,N/A,Ngân hàng Lộc Phát Việt Nam LPBank,2 năm kinh nghiệm,"LPB Tower, số 210 Đường Trần Quang Khải, French Quarter, Trang Tien, Hoàn Kiếm, Hanoi, Vietnam",Thương lượng,"Hệ Thống Oracle, Lập Trình SQL Server, Linux, Quản Trị Hệ Thống, Vận Hành Hệ Thống",https://www.vietnamworks.com/chuyen-vien-van-hanh-open-banking-and-dich-vu-ket-noi-khoi-cntt-1839419-jv?source=searchResults&searchType=2&placement=1839969&sortBy=date
Full-Stack Engineer - Onsite Singapore,Full-Stack Engineer - Onsite Singapore,N/A,FPT Software,2 năm kinh nghiệm,"[HCM]Lô T2, đường D1, khu Công nghệ cao, Quận 9, Tp.Hồ Chí Minh; [HN]Tòa nhà FPT, 17 Duy Tân, Cầu Giấy, Hà Nội; [DN] Tòa Nhà FPT Complex, Đường Nam Kỳ Khởi Nghĩa, Phường Hoà Hải, Quận Ngũ Hành Sơn, TP Đà Nẵng",Thương lượng,"Full Stack Development, JavaScript, React, Backend, AWS",https://www.vietnamworks.com/full-stack-engineer-onsite-singapore-1830620-jv?source=searchResults&searchType=2&placement=1830770&sortBy=date
Senior / Lead Test Engineer (Automation & Manual),Senior / Lead Test Engineer Automation & Manual,['Senior'],Hitachi Digital Services,3 năm kinh nghiệm,"Floor 3rd, 4th Helios Building - Floor 9th QTSC9 Building, Quang Trung Software City, Tan Chanh Hiep Ward, District 12","$ 700-1,800 /tháng","API Testing, Automation Testing, English Communication, Manual Testing, PL/SQL",https://www.vietnamworks.com/senior-lead-test-engineer-automation-and-manual-1844119-jv?source=searchResults&searchType=2&placement=1844269&sortBy=date
Product Manager,Product Manager,N/A,Công Ty Cổ Phần Công Nghệ Sen Đỏ,5 năm kinh nghiệm,"Tầng 2, Tòa nhà FPT Tân Thuận, Lô L29B-31-33B, đường số 8, KCX Tân Thuận, Q.7, TP.HCM",Thương lượng,"Agile, Phát Triển Phần Mềm, Quản Trị Dự Án, Sáng Tạo, UI/UX",https://www.vietnamworks.com/product-manager-1842312-jv?source=searchResults&searchType=2&placement=1842662&sortBy=date
Mobile Game Research Assistant (Contractor),Mobile Game Research Assistant Contractor,N/A,Athena Studio,1 năm kinh nghiệm,"40A Lam Sơn, Phường 2, Quận Tân Bình, TPHCM",Thương lượng,"Mobile Game Development, Data Entry, Competitor Analysis, Market Research, Game Research",https://www.vietnamworks.com/mobile-game-research-assistant-contractor-1840899-jv?source=searchResults&searchType=2&placement=1840999&sortBy=date
SAP S/4Hana Consultant,SAP S/4Hana Consultant,N/A,Chi Nhánh Công Ty TNHH KPMG,1 năm kinh nghiệm,"10Floor, 115 Nguyễn Huệ, Ho Chi Minh City, Ho Chi Minh, Vietnam",Thương lượng,"Business Process Management, Client Relationship, SAP, Time Management, Sap Module Development",https://www.vietnamworks.com/sap-s4hana-consultant-1837352-jv?source=searchResults&searchType=2&placement=1837752&sortBy=date
QC Engineer,QC Engineer,N/A,"Galaxy Digital Holdings Co., Ltd (GH)",2 năm kinh nghiệm,"Galaxy Innovation Hub, Road D1, Hi-Tech Park, District 9, HCMC.","1,000-30tr ₫/tháng","Bug Management, Japanese N3, Performance Test, Problem-solving, Test Automation Tools",https://www.vietnamworks.com/qc-engineer-1831556-jv?source=searchResults&searchType=2&placement=1832006&sortBy=date
Head of Software Engineering ( Bank / Fintech),Head of Software Engineering Bank / Fintech,N/A,GTV Vietnam,10 năm kinh nghiệm,"Nguyen Thi Minh Khai, District 1, HCMC",Thương lượng,"Software Architecture Design, Leadership, Planning and Management, Software Engineering, AWS",https://www.vietnamworks.com/head-of-software-engineering-bank-fintech-1836102-jv?source=searchResults&searchType=2&placement=1836602&sortBy=date
Operation Analyst,Operation Analyst,N/A,Công Ty Bảo Hiểm Nhân Thọ Cathay,2 năm kinh nghiệm,"The 9th, 46-48-50 Pham Hong Thai St., Dist. 1, HCMC",Thương lượng,"Claims Adjusting, Underwriting, Life Insurance, IT Operations",https://www.vietnamworks.com/operation-analyst--1842611-jv?source=searchResults&searchType=2&placement=1843211&sortBy=date
Senior Backend Engineer (Php/laravel),Senior Backend Engineer Php/laravel,['Senior'],MAMABOX CORPORATION (VIETNAM) Company Limited,5 năm kinh nghiệm,"Tầng 6, Tòa nhà HML, số 248-250 Đường Nguyễn Đình Chiểu, Phường Võ Thị Sáu, Quận 3, Thành phố Hồ Chí Minh, Việt Nam","$ 1,800-2,500 /tháng","PHP, Laravel, RESTful API, Backend",https://www.vietnamworks.com/senior-backend-engineer-phplaravel-1838660-jv?source=searchResults&searchType=2&placement=1838960&sortBy=date
UI/UX Interaction Designer,UI/UX Interaction Designer,N/A,Cathay United Bank,3 năm kinh nghiệm,"Taipei, Taiwan",Thương lượng,"Google Material Design, Interaction Design, Mobile Interface Design, System Design, UI Design",https://www.vietnamworks.com/uiux-interaction-designer-1839464-jv?source=searchResults&searchType=2&placement=1839914&sortBy=date
Technical Lead/ Senior Java Developer,Technical Lead/ Senior Java Developer,['Senior'],Hitachi Digital Services,5 năm kinh nghiệm,"Floor 3rd, 4th Helios Building - Floor 9th QTSC9 Building, Quang Trung Software City, Tan Chanh Hiep Ward, District 12",Thương lượng,"Java, Spring Boot, Jsp/Angular, AWS, AWS",https://www.vietnamworks.com/technical-lead-senior-java-developer-1832670-jv?source=searchResults&searchType=2&placement=1832820&sortBy=date
Full-Stack Developer (Up to 30M VND),Full-Stack Developer Up to 30M VND,N/A,"Br24 Vietnam Co.,Ltd",2 năm kinh nghiệm,"No. 6 Nguyen Cong Hoan, Ngoc Khanh, Ba Dinh, Hanoi.","Tới $ 1,300 /tháng","Full Stack Development, RESTful API, Node.JS, Vue.js, CloudFront",https://www.vietnamworks.com/full-stack-developer-up-to-30m-vnd-1842617-jv?source=searchResults&searchType=2&placement=1843217&sortBy=date
Database Developer (DBA),Database Developer DBA,N/A,Navigos Group,2 năm kinh nghiệm,"HCM Office: 20th Floor, E Town Central - 11 Doan Van Bo, Ward 13, District 4; Hanoi office: 8th Floor, V Building, 125-127 Ba Trieu St, Hai Ba Trung District","$ 600-1,000 /tháng","MS SQL Server, Mysql, Python, Crm Databases, Ssrs",https://www.vietnamworks.com/database-developer-dba-1840117-jv?source=searchResults&searchType=2&placement=1840167&sortBy=date
Senior Business Analyst Specialist,Senior Business Analyst Specialist,['Senior'],Be Group Joint Stock Company,2 năm kinh nghiệm,"Tòa nhà Five Star - 28bis Mạc Đĩnh Chi, Phường Đa kao, Quận 1, Thành Phố Hồ Chí Minh",Thương lượng,"Analytical skills, Communication skills, SQL knowledge, Data analysis, Strategy Consulting",https://www.vietnamworks.com/senior-business-analyst-specialist-1835675-jv?source=searchResults&searchType=2&placement=1836275&sortBy=date
"Backend Developer (Java, Spring Boot ) BE Dev","Backend Developer Java, Spring Boot BE Dev",N/A,GTV VIETNAM,4 năm kinh nghiệm,N/A,Thương lượng,"AWS, RESTful API, AWS, Spring Boot, Banking, Microservices",https://www.vietnamworks.com/backend-developer-java-spring-boot-be-dev-1836113-jv?source=searchResults&searchType=2&placement=1836663&sortBy=date
Data Scientist/senior Data Scientist,Data Scientist/senior Data Scientist,['senior'],Navigos Search's Client,3 năm kinh nghiệm,Hanoi,"$ 2,500-3,000 /tháng","Agile Methodologies, Data Analysis, Deep Learning, Deep Learning, Deep Learning, Machine Learning, Statistical Modeling",https://www.vietnamworks.com/data-scientistsenior-data-scientist-1841315-jv?source=searchResults&searchType=2&placement=1841965&sortBy=date
Senior SAP EWM Consultant,Senior SAP EWM Consultant,['Senior'],Navigos Search's Client,5 năm kinh nghiệm,Hanoi / HCMC,$ 60tr-80tr /tháng,"Sap Ewm Expertise, Logistics, Supply Chain Management, SAP Certificate, English Fluency",https://www.vietnamworks.com/senior-sap-ewm-consultant-1843454-jv?source=searchResults&searchType=2&placement=1844004&sortBy=date
Automation Engineer,Automation Engineer,N/A,Công Ty TNHH LEGO Manufacturing Việt Nam,Không yêu cầu năm kinh nghiệm,N/A,Thương lượng,"PLC, Automation, Lập Trình Rockwell, Manufacturing Engineering, Maintenance",https://www.vietnamworks.com/automation-engineer--1839656-jv?source=searchResults&searchType=2&placement=1839806&sortBy=date
Quality Engineer,Quality Engineer,N/A,"Molex Vietnam Co., Ltd.",5 năm kinh nghiệm,"P-15, Thang Long Industrial Park",Thương lượng,"5W2H, 7 QC Tools, 8D, Good Communication Skill",https://www.vietnamworks.com/quality-engineer-1826427-jv?source=searchResults&searchType=2&placement=1826927&sortBy=date
IT Program Manager [ Banking / Finance / Securities ],IT Program Manager Banking / Finance / Securities,N/A,GTV VIETNAM,6 năm kinh nghiệm,N/A,Thương lượng,"Leadership, Project Management, Agile Principles, Banking Product, English",https://www.vietnamworks.com/it-program-manager-banking-finance-securities-1842367-jv?source=searchResults&searchType=2&placement=1842717&sortBy=date
ITO Project Manager (Fluent Korean & English),ITO Project Manager Fluent Korean & English,N/A,Công Ty TNHH CJ Olivenetworks VINA,5 năm kinh nghiệm,"6 Le Thanh Ton, Ben Nghe Ward, District 1, HCMC, District 1, Ho Chi Minh","$ 3,000-6,000 /tháng","Korean, English, Project Management, Ecommerce Technology, Java",https://www.vietnamworks.com/ito-project-manager-fluent-korean-english--1839972-jv?source=searchResults&searchType=2&placement=1840372&sortBy=date
IT Network Engineer,IT Network Engineer,N/A,"Amkor Technology Vietnam Llc.,",1 năm kinh nghiệm,"Yen Phong II-C IP, Dong Tien Commune, Yen Phong District, Bac Ninh, Viet Nam",Thương lượng,"Network Security, Wireless, Firewall, Cisco, IT Security",https://www.vietnamworks.com/it-network-engineer--1823598-jv?source=searchResults&searchType=2&placement=1823698&sortBy=date
Full Stack Java Developer (Không yêu cầu tiếng anh giao tiếp),Full Stack Java Developer Không yêu cầu tiếng anh giao tiếp,N/A,Navigos Search's Client,3 năm kinh nghiệm,Hanoi,20tr-40tr ₫/tháng,"Java, JavaScript, Microservices, Spring, VueJS, VueJS",https://www.vietnamworks.com/full-stack-java-developer-khong-yeu-cau-tieng-anh-giao-tiep-1836964-jv?source=searchResults&searchType=2&placement=1837664&sortBy=date
Data Engineer Executive,Data Engineer Executive,N/A,"Schenker Vietnam CO., Ltd.,ho Chi Minh City (Vn6000)",1 năm kinh nghiệm,"Tầng 14- Tháp A, số 285 đường Cách Mạng Tháng Tám, Phường 12, Quận 10, Thành phố Hồ Chí Minh, Việt Nam",$ 500-800 /tháng,"Data Engineering, Data Analysis, Logistics Operations, Transport Management System (TMS), Systems Implementation",https://www.vietnamworks.com/data-engineer-executive-1837103-jv?source=searchResults&searchType=2&placement=1837453&sortBy=date
Associate Product Manager - Digital Identity,Associate Product Manager - Digital Identity,N/A,VNG Corporation,3 năm kinh nghiệm,"VNG Campus, Khu chế xuất Tân Thuận, Quận 7",Thương lượng,"eKYC, Digital transformation, SaaS, technology transformation, Product Development",https://www.vietnamworks.com/associate-product-manager-digital-identity-1840146-jv?source=searchResults&searchType=2&placement=1840246&sortBy=date
"Manager, Bancassurance Income Management","Manager, Bancassurance Income Management",N/A,FWD Vietnam Life Insurance Company Limited,5 năm kinh nghiệm,"11th Floor, Diamond Plaza Building, 34 Le Duan Street, Ben Nghe Ward, District 1, Ho Chi Minh City, Vietnam",Thương lượng,"SQL, MIS, Data analysis, Data Calculation, Reporting Skills",https://www.vietnamworks.com/manager-bancassurance-income-management-1839887-jv?source=searchResults&searchType=2&placement=1840087&sortBy=date
Software Developer – Team Lead,Software Developer – Team Lead,N/A,Công Ty TNHH Century Distribution Systems (International) Limited,Không yêu cầu năm kinh nghiệm,"Unit 2805, 28th Floor, BEA Tower. Millennium City 5, 418 Kwun Tong Road, Kwun Tong, Kowloon, Hong Kong, China","$ 800-1,000 /tháng","SQL, C#, Software Development, RESTful API, CSS",https://www.vietnamworks.com/software-developer-team-lead-1838781-jv?source=searchResults&searchType=2&placement=1839431&sortBy=date
